month,date,entry_time,exit_time,qty_per_leg,ce_strike,pe_strike,ce_entry_price,pe_entry_price,ce_exit_price,pe_exit_price,entry_combined_premium,exit_combined_premium,pair_stoploss_level,pair_pnl,exit_reason,ce_file,pe_file,event_dt,market_pair_pnl,kill_switch_adjustment,cum_realized_pnl
January,01-01-2024,12:30:00,14:42:00,150,21950,21450,36.45,22.4,77.3,11.4,58.85,88.7,88.275,-4477.5,PAIR_STOPLOSS_HIT,NIFTY24010421950CE.csv,NIFTY24010421450PE.csv,2024-01-01 14:42:00,,0.0,-4477.5
January,01-01-2024,09:45:00,14:43:00,150,21950,21450,38.1,30.3,81.75,11.45,68.4,93.2,102.6,-2969.38,MAX_LOSS_EXIT_STRICT,NIFTY24010421950CE.csv,NIFTY24010421450PE.csv,2024-01-01 14:43:00,-3720.0,0.0,-7446.88
January,01-01-2024,10:00:00,14:43:00,150,21950,21450,44.95,25.65,81.75,11.45,70.6,93.2,105.9,-2705.97,MAX_LOSS_EXIT_STRICT,NIFTY24010421950CE.csv,NIFTY24010421450PE.csv,2024-01-01 14:43:00,-3390.0,0.0,-10152.85
January,01-01-2024,10:15:00,14:43:00,150,21950,21450,41.1,25.7,81.75,11.45,66.8,93.2,100.2,-3160.95,MAX_LOSS_EXIT_STRICT,NIFTY24010421950CE.csv,NIFTY24010421450PE.csv,2024-01-01 14:43:00,-3960.0,0.0,-13313.8
January,01-01-2024,10:30:00,14:43:00,150,21950,21450,37.7,26.05,81.75,11.45,63.75,93.2,95.625,-3526.14,MAX_LOSS_EXIT_STRICT,NIFTY24010421950CE.csv,NIFTY24010421450PE.csv,2024-01-01 14:43:00,-4417.5,0.0,-16839.94
January,01-01-2024,10:45:00,14:43:00,150,21950,21450,39.65,23.8,81.75,11.45,63.45,93.2,95.175,-3562.06,MAX_LOSS_EXIT_STRICT,NIFTY24010421950CE.csv,NIFTY24010421450PE.csv,2024-01-01 14:43:00,-4462.5,0.0,-20402.0
January,01-01-2024,11:00:00,14:43:00,150,22000,21500,33.35,27.45,61.7,14.45,60.8,76.15,91.2,-1837.9,MAX_LOSS_EXIT_STRICT,NIFTY24010422000CE.csv,NIFTY24010421500PE.csv,2024-01-01 14:43:00,-2302.5,0.0,-22239.9
January,01-01-2024,11:15:00,14:43:00,150,22000,21500,32.45,28.1,61.7,14.45,60.55,76.15,90.825,-1867.84,MAX_LOSS_EXIT_STRICT,NIFTY24010422000CE.csv,NIFTY24010421500PE.csv,2024-01-01 14:43:00,-2340.0,0.0,-24107.74
January,01-01-2024,11:30:00,14:43:00,150,22000,21500,33.8,26.8,61.7,14.45,60.6,76.15,90.9,-1861.85,MAX_LOSS_EXIT_STRICT,NIFTY24010422000CE.csv,NIFTY24010421500PE.csv,2024-01-01 14:43:00,-2332.5,0.0,-25969.59
January,01-01-2024,11:45:00,14:43:00,150,22000,21500,30.05,29.35,61.7,14.45,59.4,76.15,89.1,-2005.53,MAX_LOSS_EXIT_STRICT,NIFTY24010422000CE.csv,NIFTY24010421500PE.csv,2024-01-01 14:43:00,-2512.5,0.0,-27975.12
January,01-01-2024,12:00:00,14:43:00,150,22000,21500,29.15,29.3,61.7,14.45,58.45,76.15,87.675,-2119.27,MAX_LOSS_EXIT_STRICT,NIFTY24010422000CE.csv,NIFTY24010421500PE.csv,2024-01-01 14:43:00,-2655.0,0.0,-30094.39
January,01-01-2024,12:15:00,14:43:00,150,22000,21500,31.9,24.6,61.7,14.45,56.5,76.15,84.75,-2352.75,MAX_LOSS_EXIT_STRICT,NIFTY24010422000CE.csv,NIFTY24010421500PE.csv,2024-01-01 14:43:00,-2947.5,0.0,-32447.14
January,01-01-2024,12:45:00,14:43:00,150,22000,21500,29.0,25.2,61.7,14.45,54.2,76.15,81.3,-2628.14,MAX_LOSS_EXIT_STRICT,NIFTY24010422000CE.csv,NIFTY24010421500PE.csv,2024-01-01 14:43:00,-3292.5,0.0,-35075.28
January,01-01-2024,13:00:00,14:43:00,150,22000,21500,29.05,24.65,61.7,14.45,53.7,76.15,80.55,-2688.01,MAX_LOSS_EXIT_STRICT,NIFTY24010422000CE.csv,NIFTY24010421500PE.csv,2024-01-01 14:43:00,-3367.5,0.0,-37763.29
January,01-01-2024,13:15:00,14:43:00,150,22000,21500,30.25,24.0,61.7,14.45,54.25,76.15,81.375,-2622.15,MAX_LOSS_EXIT_STRICT,NIFTY24010422000CE.csv,NIFTY24010421500PE.csv,2024-01-01 14:43:00,-3285.0,0.0,-40385.44
January,01-01-2024,13:30:00,14:43:00,150,22000,21500,30.1,23.15,61.7,14.45,53.25,76.15,79.875,-2741.89,MAX_LOSS_EXIT_STRICT,NIFTY24010422000CE.csv,NIFTY24010421500PE.csv,2024-01-01 14:43:00,-3435.0,0.0,-43127.33
January,01-01-2024,13:45:00,14:43:00,150,22000,21500,28.7,22.8,61.7,14.45,51.5,76.15,77.25,-2951.42,MAX_LOSS_EXIT_STRICT,NIFTY24010422000CE.csv,NIFTY24010421500PE.csv,2024-01-01 14:43:00,-3697.5,0.0,-46078.75
January,01-01-2024,14:00:00,14:43:00,150,22000,21500,37.05,19.5,61.7,14.45,56.55,76.15,84.825,-2346.77,MAX_LOSS_EXIT_STRICT,NIFTY24010422000CE.csv,NIFTY24010421500PE.csv,2024-01-01 14:43:00,-2940.0,0.0,-48425.52
January,01-01-2024,14:15:00,14:43:00,150,22050,21550,35.2,22.3,45.85,18.2,57.5,64.05,86.25,-784.25,MAX_LOSS_EXIT_STRICT,NIFTY24010422050CE.csv,NIFTY24010421550PE.csv,2024-01-01 14:43:00,-982.5,0.0,-49209.77
January,01-01-2024,14:30:00,14:43:00,150,22050,21550,35.45,22.0,45.85,18.2,57.45,64.05,86.175,-790.23,MAX_LOSS_EXIT_STRICT_ADJ,NIFTY24010422050CE.csv,NIFTY24010421550PE.csv,2024-01-01 14:43:00,-990.0,0.01,-50000.0
January,02-01-2024,09:45:00,10:36:00,150,22000,21500,20.85,21.8,12.05,60.75,42.65,72.8,63.975,-4522.5,PAIR_STOPLOSS_HIT,NIFTY24010422000CE.csv,NIFTY24010421500PE.csv,2024-01-02 10:36:00,,,-4522.5
January,02-01-2024,10:00:00,14:59:00,150,21900,21400,24.8,22.25,17.35,18.5,47.05,35.85,70.575,1680.0,FORCE_EXIT_1459,NIFTY24010421900CE.csv,NIFTY24010421400PE.csv,2024-01-02 14:59:00,,,-2842.5
January,02-01-2024,10:15:00,14:59:00,150,21900,21400,27.0,18.6,17.35,18.5,45.6,35.85,68.4,1462.5,FORCE_EXIT_1459,NIFTY24010421900CE.csv,NIFTY24010421400PE.csv,2024-01-02 14:59:00,,,-1380.0
January,02-01-2024,10:30:00,14:59:00,150,21850,21350,29.2,18.35,25.3,13.95,47.55,39.25,71.325,1245.0,FORCE_EXIT_1459,NIFTY24010421850CE.csv,NIFTY24010421350PE.csv,2024-01-02 14:59:00,,,-135.0
January,02-01-2024,10:45:00,14:59:00,150,21850,21350,27.0,25.7,25.3,13.95,52.7,39.25,79.05,2017.5,FORCE_EXIT_1459,NIFTY24010421850CE.csv,NIFTY24010421350PE.csv,2024-01-02 14:59:00,,,1882.5
January,02-01-2024,11:00:00,14:59:00,150,21850,21350,28.15,19.95,25.3,13.95,48.1,39.25,72.15,1327.5,FORCE_EXIT_1459,NIFTY24010421850CE.csv,NIFTY24010421350PE.csv,2024-01-02 14:59:00,,,3210.0
January,02-01-2024,11:15:00,14:59:00,150,21850,21350,24.3,25.0,25.3,13.95,49.3,39.25,73.95,1507.5,FORCE_EXIT_1459,NIFTY24010421850CE.csv,NIFTY24010421350PE.csv,2024-01-02 14:59:00,,,4717.5
January,02-01-2024,11:30:00,14:59:00,150,21850,21350,25.9,21.75,25.3,13.95,47.65,39.25,71.475,1260.0,FORCE_EXIT_1459,NIFTY24010421850CE.csv,NIFTY24010421350PE.csv,2024-01-02 14:59:00,,,5977.5
January,02-01-2024,11:45:00,14:59:00,150,21850,21350,24.15,23.05,25.3,13.95,47.2,39.25,70.8,1192.5,FORCE_EXIT_1459,NIFTY24010421850CE.csv,NIFTY24010421350PE.csv,2024-01-02 14:59:00,,,7170.0
January,02-01-2024,12:00:00,14:59:00,150,21850,21350,24.65,21.05,25.3,13.95,45.7,39.25,68.55,967.5,FORCE_EXIT_1459,NIFTY24010421850CE.csv,NIFTY24010421350PE.csv,2024-01-02 14:59:00,,,8137.5
January,02-01-2024,12:15:00,14:59:00,150,21850,21350,27.8,18.3,25.3,13.95,46.1,39.25,69.15,1027.5,FORCE_EXIT_1459,NIFTY24010421850CE.csv,NIFTY24010421350PE.csv,2024-01-02 14:59:00,,,9165.0
January,02-01-2024,12:30:00,14:59:00,150,21900,21400,19.3,22.25,17.35,18.5,41.55,35.85,62.325,855.0,FORCE_EXIT_1459,NIFTY24010421900CE.csv,NIFTY24010421400PE.csv,2024-01-02 14:59:00,,,10020.0
January,02-01-2024,12:45:00,14:59:00,150,21900,21400,19.75,20.75,17.35,18.5,40.5,35.85,60.75,697.5,FORCE_EXIT_1459,NIFTY24010421900CE.csv,NIFTY24010421400PE.csv,2024-01-02 14:59:00,,,10717.5
January,02-01-2024,13:00:00,14:59:00,150,21900,21400,17.85,23.9,17.35,18.5,41.75,35.85,62.625,885.0,FORCE_EXIT_1459,NIFTY24010421900CE.csv,NIFTY24010421400PE.csv,2024-01-02 14:59:00,,,11602.5
January,02-01-2024,13:15:00,14:59:00,150,21850,21350,23.85,17.85,25.3,13.95,41.7,39.25,62.55,367.5,FORCE_EXIT_1459,NIFTY24010421850CE.csv,NIFTY24010421350PE.csv,2024-01-02 14:59:00,,,11970.0
January,02-01-2024,13:30:00,14:59:00,150,21900,21400,16.65,23.85,17.35,18.5,40.5,35.85,60.75,697.5,FORCE_EXIT_1459,NIFTY24010421900CE.csv,NIFTY24010421400PE.csv,2024-01-02 14:59:00,,,12667.5
January,02-01-2024,13:45:00,14:59:00,150,21900,21400,17.8,21.05,17.35,18.5,38.85,35.85,58.275,450.0,FORCE_EXIT_1459,NIFTY24010421900CE.csv,NIFTY24010421400PE.csv,2024-01-02 14:59:00,,,13117.5
January,02-01-2024,14:00:00,14:59:00,150,21900,21400,17.6,20.95,17.35,18.5,38.55,35.85,57.825,405.0,FORCE_EXIT_1459,NIFTY24010421900CE.csv,NIFTY24010421400PE.csv,2024-01-02 14:59:00,,,13522.5
January,02-01-2024,14:15:00,14:59:00,150,21900,21400,21.95,16.0,17.35,18.5,37.95,35.85,56.925,315.0,FORCE_EXIT_1459,NIFTY24010421900CE.csv,NIFTY24010421400PE.csv,2024-01-02 14:59:00,,,13837.5
January,02-01-2024,14:30:00,14:59:00,150,21900,21400,22.0,16.3,17.35,18.5,38.3,35.85,57.45,367.5,FORCE_EXIT_1459,NIFTY24010421900CE.csv,NIFTY24010421400PE.csv,2024-01-02 14:59:00,,,14205.0
January,02-01-2024,14:45:00,14:59:00,150,21950,21450,16.2,19.65,12.1,24.65,35.85,36.75,53.775,-135.0,FORCE_EXIT_1459,NIFTY24010421950CE.csv,NIFTY24010421450PE.csv,2024-01-02 14:59:00,,,14070.0
January,03-01-2024,09:45:00,14:59:00,150,21750,21350,20.8,18.95,7.75,8.95,39.75,16.7,59.625,3457.5,FORCE_EXIT_1459,NIFTY24010421750CE.csv,NIFTY24010421350PE.csv,2024-01-03 14:59:00,,,3457.5
January,03-01-2024,10:00:00,14:59:00,150,21800,21400,13.15,23.35,4.8,14.55,36.5,19.35,54.75,2572.5,FORCE_EXIT_1459,NIFTY24010421800CE.csv,NIFTY24010421400PE.csv,2024-01-03 14:59:00,,,6030.0
January,03-01-2024,10:15:00,14:59:00,150,21800,21400,13.55,20.95,4.8,14.55,34.5,19.35,51.75,2272.5,FORCE_EXIT_1459,NIFTY24010421800CE.csv,NIFTY24010421400PE.csv,2024-01-03 14:59:00,,,8302.5
January,03-01-2024,10:30:00,14:59:00,150,21750,21350,18.45,14.8,7.75,8.95,33.25,16.7,49.875,2482.5,FORCE_EXIT_1459,NIFTY24010421750CE.csv,NIFTY24010421350PE.csv,2024-01-03 14:59:00,,,10785.0
January,03-01-2024,10:45:00,14:59:00,150,21750,21350,16.4,16.25,7.75,8.95,32.65,16.7,48.975,2392.5,FORCE_EXIT_1459,NIFTY24010421750CE.csv,NIFTY24010421350PE.csv,2024-01-03 14:59:00,,,13177.5
January,03-01-2024,11:00:00,14:59:00,150,21750,21350,16.2,13.35,7.75,8.95,29.55,16.7,44.325,1927.5,FORCE_EXIT_1459,NIFTY24010421750CE.csv,NIFTY24010421350PE.csv,2024-01-03 14:59:00,,,15105.0
January,03-01-2024,11:15:00,14:59:00,150,21750,21350,15.5,12.3,7.75,8.95,27.8,16.7,41.7,1665.0,FORCE_EXIT_1459,NIFTY24010421750CE.csv,NIFTY24010421350PE.csv,2024-01-03 14:59:00,,,16770.0
January,03-01-2024,11:30:00,14:59:00,150,21750,21350,15.4,12.55,7.75,8.95,27.95,16.7,41.925,1687.5,FORCE_EXIT_1459,NIFTY24010421750CE.csv,NIFTY24010421350PE.csv,2024-01-03 14:59:00,,,18457.5
January,03-01-2024,11:45:00,14:59:00,150,21800,21400,10.75,16.6,4.8,14.55,27.35,19.35,41.025,1200.0,FORCE_EXIT_1459,NIFTY24010421800CE.csv,NIFTY24010421400PE.csv,2024-01-03 14:59:00,,,19657.5
January,03-01-2024,12:00:00,14:59:00,150,21750,21350,15.9,10.65,7.75,8.95,26.55,16.7,39.825,1477.5,FORCE_EXIT_1459,NIFTY24010421750CE.csv,NIFTY24010421350PE.csv,2024-01-03 14:59:00,,,21135.0
January,03-01-2024,12:15:00,14:59:00,150,21750,21350,14.65,12.2,7.75,8.95,26.85,16.7,40.275,1522.5,FORCE_EXIT_1459,NIFTY24010421750CE.csv,NIFTY24010421350PE.csv,2024-01-03 14:59:00,,,22657.5
January,03-01-2024,12:30:00,14:59:00,150,21750,21350,11.1,15.4,7.75,8.95,26.5,16.7,39.75,1470.0,FORCE_EXIT_1459,NIFTY24010421750CE.csv,NIFTY24010421350PE.csv,2024-01-03 14:59:00,,,24127.5
January,03-01-2024,12:45:00,14:59:00,150,21750,21350,11.2,14.65,7.75,8.95,25.85,16.7,38.775,1372.5,FORCE_EXIT_1459,NIFTY24010421750CE.csv,NIFTY24010421350PE.csv,2024-01-03 14:59:00,,,25500.0
January,03-01-2024,13:00:00,14:59:00,150,21750,21350,12.6,10.65,7.75,8.95,23.25,16.7,34.875,982.5,FORCE_EXIT_1459,NIFTY24010421750CE.csv,NIFTY24010421350PE.csv,2024-01-03 14:59:00,,,26482.5
January,03-01-2024,13:15:00,14:59:00,150,21750,21350,12.75,11.7,7.75,8.95,24.45,16.7,36.675,1162.5,FORCE_EXIT_1459,NIFTY24010421750CE.csv,NIFTY24010421350PE.csv,2024-01-03 14:59:00,,,27645.0
January,03-01-2024,13:30:00,14:59:00,150,21750,21350,12.6,11.35,7.75,8.95,23.95,16.7,35.925,1087.5,FORCE_EXIT_1459,NIFTY24010421750CE.csv,NIFTY24010421350PE.csv,2024-01-03 14:59:00,,,28732.5
January,03-01-2024,13:45:00,14:59:00,150,21750,21350,10.9,11.45,7.75,8.95,22.35,16.7,33.525,847.5,FORCE_EXIT_1459,NIFTY24010421750CE.csv,NIFTY24010421350PE.csv,2024-01-03 14:59:00,,,29580.0
January,03-01-2024,14:00:00,14:59:00,150,21750,21350,10.5,10.4,7.75,8.95,20.9,16.7,31.35,630.0,FORCE_EXIT_1459,NIFTY24010421750CE.csv,NIFTY24010421350PE.csv,2024-01-03 14:59:00,,,30210.0
January,03-01-2024,14:15:00,14:59:00,150,21750,21350,10.1,10.45,7.75,8.95,20.55,16.7,30.825,577.5,FORCE_EXIT_1459,NIFTY24010421750CE.csv,NIFTY24010421350PE.csv,2024-01-03 14:59:00,,,30787.5
January,03-01-2024,14:30:00,14:59:00,150,21750,21350,8.45,9.55,7.75,8.95,18.0,16.7,27.0,195.0,FORCE_EXIT_1459,NIFTY24010421750CE.csv,NIFTY24010421350PE.csv,2024-01-03 14:59:00,,,30982.5
January,03-01-2024,14:45:00,14:59:00,150,21750,21350,7.45,10.55,7.75,8.95,18.0,16.7,27.0,195.0,FORCE_EXIT_1459,NIFTY24010421750CE.csv,NIFTY24010421350PE.csv,2024-01-03 14:59:00,,,31177.5
January,04-01-2024,09:45:00,14:59:00,150,21750,21450,2.6,2.8,0.2,0.1,5.4,0.3,8.1,765.0,FORCE_EXIT_1459,NIFTY24010421750CE.csv,NIFTY24010421450PE.csv,2024-01-04 14:59:00,,,765.0
January,04-01-2024,10:00:00,14:59:00,150,21750,21450,2.15,2.95,0.2,0.1,5.1,0.3,7.65,720.0,FORCE_EXIT_1459,NIFTY24010421750CE.csv,NIFTY24010421450PE.csv,2024-01-04 14:59:00,,,1485.0
January,04-01-2024,10:15:00,14:59:00,150,21800,21500,1.15,3.5,0.15,0.25,4.65,0.4,6.975,637.5,FORCE_EXIT_1459,NIFTY24010421800CE.csv,NIFTY24010421500PE.csv,2024-01-04 14:59:00,,,2122.5
January,04-01-2024,10:30:00,14:59:00,150,21800,21500,1.1,2.75,0.15,0.25,3.85,0.4,5.775,517.5,FORCE_EXIT_1459,NIFTY24010421800CE.csv,NIFTY24010421500PE.csv,2024-01-04 14:59:00,,,2640.0
January,04-01-2024,10:45:00,14:59:00,150,21800,21500,1.1,2.6,0.15,0.25,3.7,0.4,5.55,495.0,FORCE_EXIT_1459,NIFTY24010421800CE.csv,NIFTY24010421500PE.csv,2024-01-04 14:59:00,,,3135.0
January,04-01-2024,11:00:00,14:59:00,150,21800,21500,0.95,2.25,0.15,0.25,3.2,0.4,4.8,420.0,FORCE_EXIT_1459,NIFTY24010421800CE.csv,NIFTY24010421500PE.csv,2024-01-04 14:59:00,,,3555.0
January,04-01-2024,11:15:00,14:59:00,150,21800,21500,1.05,2.05,0.15,0.25,3.1,0.4,4.65,405.0,FORCE_EXIT_1459,NIFTY24010421800CE.csv,NIFTY24010421500PE.csv,2024-01-04 14:59:00,,,3960.0
January,04-01-2024,11:30:00,14:59:00,150,21800,21500,0.7,2.0,0.15,0.25,2.7,0.4,4.05,345.0,FORCE_EXIT_1459,NIFTY24010421800CE.csv,NIFTY24010421500PE.csv,2024-01-04 14:59:00,,,4305.0
January,04-01-2024,11:45:00,14:59:00,150,21800,21500,0.7,1.75,0.15,0.25,2.45,0.4,3.675,307.5,FORCE_EXIT_1459,NIFTY24010421800CE.csv,NIFTY24010421500PE.csv,2024-01-04 14:59:00,,,4612.5
January,04-01-2024,12:00:00,14:59:00,150,21800,21500,0.75,1.55,0.15,0.25,2.3,0.4,3.45,285.0,FORCE_EXIT_1459,NIFTY24010421800CE.csv,NIFTY24010421500PE.csv,2024-01-04 14:59:00,,,4897.5
January,04-01-2024,12:15:00,14:59:00,150,21800,21500,0.7,1.8,0.15,0.25,2.5,0.4,3.75,315.0,FORCE_EXIT_1459,NIFTY24010421800CE.csv,NIFTY24010421500PE.csv,2024-01-04 14:59:00,,,5212.5
January,04-01-2024,12:30:00,14:59:00,150,21800,21500,0.8,1.55,0.15,0.25,2.35,0.4,3.525,292.5,FORCE_EXIT_1459,NIFTY24010421800CE.csv,NIFTY24010421500PE.csv,2024-01-04 14:59:00,,,5505.0
January,04-01-2024,12:45:00,14:59:00,150,21800,21500,0.7,1.3,0.15,0.25,2.0,0.4,3.0,240.0,FORCE_EXIT_1459,NIFTY24010421800CE.csv,NIFTY24010421500PE.csv,2024-01-04 14:59:00,,,5745.0
January,04-01-2024,13:00:00,14:59:00,150,21800,21500,0.65,1.15,0.15,0.25,1.8,0.4,2.7,210.0,FORCE_EXIT_1459,NIFTY24010421800CE.csv,NIFTY24010421500PE.csv,2024-01-04 14:59:00,,,5955.0
January,04-01-2024,13:15:00,14:59:00,150,21800,21500,0.7,0.95,0.15,0.25,1.65,0.4,2.475,187.5,FORCE_EXIT_1459,NIFTY24010421800CE.csv,NIFTY24010421500PE.csv,2024-01-04 14:59:00,,,6142.5
January,04-01-2024,13:30:00,14:59:00,150,21800,21500,0.6,1.2,0.15,0.25,1.8,0.4,2.7,210.0,FORCE_EXIT_1459,NIFTY24010421800CE.csv,NIFTY24010421500PE.csv,2024-01-04 14:59:00,,,6352.5
January,04-01-2024,13:45:00,14:59:00,150,21800,21500,0.55,0.75,0.15,0.25,1.3,0.4,1.95,135.0,FORCE_EXIT_1459,NIFTY24010421800CE.csv,NIFTY24010421500PE.csv,2024-01-04 14:59:00,,,6487.5
January,04-01-2024,14:00:00,14:59:00,150,21800,21500,0.65,0.85,0.15,0.25,1.5,0.4,2.25,165.0,FORCE_EXIT_1459,NIFTY24010421800CE.csv,NIFTY24010421500PE.csv,2024-01-04 14:59:00,,,6652.5
January,04-01-2024,14:15:00,14:59:00,150,21800,21500,0.45,0.7,0.15,0.25,1.15,0.4,1.725,112.5,FORCE_EXIT_1459,NIFTY24010421800CE.csv,NIFTY24010421500PE.csv,2024-01-04 14:59:00,,,6765.0
January,04-01-2024,14:30:00,14:59:00,150,21800,21500,0.35,0.55,0.15,0.25,0.9,0.4,1.35,75.0,FORCE_EXIT_1459,NIFTY24010421800CE.csv,NIFTY24010421500PE.csv,2024-01-04 14:59:00,,,6840.0
January,04-01-2024,14:45:00,14:59:00,150,21800,21500,0.25,0.35,0.15,0.25,0.6,0.4,0.9,30.0,FORCE_EXIT_1459,NIFTY24010421800CE.csv,NIFTY24010421500PE.csv,2024-01-04 14:59:00,,,6870.0
January,05-01-2024,09:45:00,14:59:00,150,22000,21400,29.65,21.2,21.8,22.4,50.85,44.2,76.275,997.5,FORCE_EXIT_1459,NIFTY24011122000CE.csv,NIFTY24011121400PE.csv,2024-01-05 14:59:00,,,997.5
January,05-01-2024,10:00:00,14:59:00,150,22050,21450,22.65,26.95,15.35,29.0,49.6,44.35,74.4,787.5,FORCE_EXIT_1459,NIFTY24011122050CE.csv,NIFTY24011121450PE.csv,2024-01-05 14:59:00,,,1785.0
January,05-01-2024,10:15:00,14:59:00,150,22050,21450,22.3,27.5,15.35,29.0,49.8,44.35,74.7,817.5,FORCE_EXIT_1459,NIFTY24011122050CE.csv,NIFTY24011121450PE.csv,2024-01-05 14:59:00,,,2602.5
January,05-01-2024,10:30:00,14:59:00,150,22050,21450,21.35,27.05,15.35,29.0,48.4,44.35,72.6,607.5,FORCE_EXIT_1459,NIFTY24011122050CE.csv,NIFTY24011121450PE.csv,2024-01-05 14:59:00,,,3210.0
January,05-01-2024,10:45:00,14:59:00,150,22000,21400,24.4,26.05,21.8,22.4,50.45,44.2,75.675,937.5,FORCE_EXIT_1459,NIFTY24011122000CE.csv,NIFTY24011121400PE.csv,2024-01-05 14:59:00,,,4147.5
January,05-01-2024,11:00:00,14:59:00,150,22000,21400,22.0,31.75,21.8,22.4,53.75,44.2,80.625,1432.5,FORCE_EXIT_1459,NIFTY24011122000CE.csv,NIFTY24011121400PE.csv,2024-01-05 14:59:00,,,5580.0
January,05-01-2024,11:15:00,14:59:00,150,22000,21400,22.7,29.4,21.8,22.4,52.1,44.2,78.15,1185.0,FORCE_EXIT_1459,NIFTY24011122000CE.csv,NIFTY24011121400PE.csv,2024-01-05 14:59:00,,,6765.0
January,05-01-2024,11:30:00,14:59:00,150,22000,21400,22.65,30.35,21.8,22.4,53.0,44.2,79.5,1320.0,FORCE_EXIT_1459,NIFTY24011122000CE.csv,NIFTY24011121400PE.csv,2024-01-05 14:59:00,,,8085.0
January,05-01-2024,11:45:00,14:59:00,150,22000,21400,20.95,33.0,21.8,22.4,53.95,44.2,80.925,1462.5,FORCE_EXIT_1459,NIFTY24011122000CE.csv,NIFTY24011121400PE.csv,2024-01-05 14:59:00,,,9547.5
January,05-01-2024,12:00:00,14:59:00,150,22000,21400,20.7,31.35,21.8,22.4,52.05,44.2,78.075,1177.5,FORCE_EXIT_1459,NIFTY24011122000CE.csv,NIFTY24011121400PE.csv,2024-01-05 14:59:00,,,10725.0
January,05-01-2024,12:15:00,14:59:00,150,22000,21400,22.4,27.9,21.8,22.4,50.3,44.2,75.45,915.0,FORCE_EXIT_1459,NIFTY24011122000CE.csv,NIFTY24011121400PE.csv,2024-01-05 14:59:00,,,11640.0
January,05-01-2024,12:30:00,14:59:00,150,22000,21400,22.65,25.75,21.8,22.4,48.4,44.2,72.6,630.0,FORCE_EXIT_1459,NIFTY24011122000CE.csv,NIFTY24011121400PE.csv,2024-01-05 14:59:00,,,12270.0
January,05-01-2024,12:45:00,14:59:00,150,22000,21400,20.95,26.45,21.8,22.4,47.4,44.2,71.1,480.0,FORCE_EXIT_1459,NIFTY24011122000CE.csv,NIFTY24011121400PE.csv,2024-01-05 14:59:00,,,12750.0
January,05-01-2024,13:00:00,14:59:00,150,22000,21400,20.3,27.4,21.8,22.4,47.7,44.2,71.55,525.0,FORCE_EXIT_1459,NIFTY24011122000CE.csv,NIFTY24011121400PE.csv,2024-01-05 14:59:00,,,13275.0
January,05-01-2024,13:15:00,14:59:00,150,22000,21400,21.55,26.15,21.8,22.4,47.7,44.2,71.55,525.0,FORCE_EXIT_1459,NIFTY24011122000CE.csv,NIFTY24011121400PE.csv,2024-01-05 14:59:00,,,13800.0
January,05-01-2024,13:30:00,14:59:00,150,22000,21400,20.8,26.55,21.8,22.4,47.35,44.2,71.025,472.5,FORCE_EXIT_1459,NIFTY24011122000CE.csv,NIFTY24011121400PE.csv,2024-01-05 14:59:00,,,14272.5
January,05-01-2024,13:45:00,14:59:00,150,22000,21400,19.35,28.5,21.8,22.4,47.85,44.2,71.775,547.5,FORCE_EXIT_1459,NIFTY24011122000CE.csv,NIFTY24011121400PE.csv,2024-01-05 14:59:00,,,14820.0
January,05-01-2024,14:00:00,14:59:00,150,21950,21350,26.8,23.3,30.55,17.55,50.1,48.1,75.15,300.0,FORCE_EXIT_1459,NIFTY24011121950CE.csv,NIFTY24011121350PE.csv,2024-01-05 14:59:00,,,15120.0
January,05-01-2024,14:15:00,14:59:00,150,21950,21350,22.3,27.8,30.55,17.55,50.1,48.1,75.15,300.0,FORCE_EXIT_1459,NIFTY24011121950CE.csv,NIFTY24011121350PE.csv,2024-01-05 14:59:00,,,15420.0
January,05-01-2024,14:30:00,14:59:00,150,21950,21350,20.75,30.15,30.55,17.55,50.9,48.1,76.35,420.0,FORCE_EXIT_1459,NIFTY24011121950CE.csv,NIFTY24011121350PE.csv,2024-01-05 14:59:00,,,15840.0
January,05-01-2024,14:45:00,14:59:00,150,22000,21400,18.9,29.2,21.8,22.4,48.1,44.2,72.15,585.0,FORCE_EXIT_1459,NIFTY24011122000CE.csv,NIFTY24011121400PE.csv,2024-01-05 14:59:00,,,16425.0
January,08-01-2024,10:30:00,11:57:00,150,21950,21450,21.9,23.4,11.55,56.65,45.3,68.2,67.95,-3435.0,PAIR_STOPLOSS_HIT,NIFTY24011121950CE.csv,NIFTY24011121450PE.csv,2024-01-08 11:57:00,,,-3435.0
January,08-01-2024,10:45:00,11:57:00,150,21950,21450,17.55,27.25,11.55,56.65,44.8,68.2,67.2,-3510.0,PAIR_STOPLOSS_HIT,NIFTY24011121950CE.csv,NIFTY24011121450PE.csv,2024-01-08 11:57:00,,,-6945.0
January,08-01-2024,10:15:00,11:58:00,150,21950,21450,20.6,26.2,11.9,59.3,46.8,71.2,70.2,-3660.0,PAIR_STOPLOSS_HIT,NIFTY24011121950CE.csv,NIFTY24011121450PE.csv,2024-01-08 11:58:00,,,-10605.0
January,08-01-2024,09:45:00,14:59:00,150,21900,21400,24.3,27.7,12.8,45.35,52.0,58.15,78.0,-922.5,FORCE_EXIT_1459,NIFTY24011121900CE.csv,NIFTY24011121400PE.csv,2024-01-08 14:59:00,,,-11527.5
January,08-01-2024,10:00:00,14:59:00,150,21900,21400,26.4,22.9,12.8,45.35,49.3,58.15,73.95,-1327.5,FORCE_EXIT_1459,NIFTY24011121900CE.csv,NIFTY24011121400PE.csv,2024-01-08 14:59:00,,,-12855.0
January,08-01-2024,11:00:00,14:59:00,150,21900,21400,21.25,25.05,12.8,45.35,46.3,58.15,69.45,-1777.5,FORCE_EXIT_1459,NIFTY24011121900CE.csv,NIFTY24011121400PE.csv,2024-01-08 14:59:00,,,-14632.5
January,08-01-2024,11:15:00,14:59:00,150,21850,21350,26.4,24.1,17.45,33.35,50.5,50.8,75.75,-45.0,FORCE_EXIT_1459,NIFTY24011121850CE.csv,NIFTY24011121350PE.csv,2024-01-08 14:59:00,,,-14677.5
January,08-01-2024,11:30:00,14:59:00,150,21900,21400,19.05,27.4,12.8,45.35,46.45,58.15,69.675,-1755.0,FORCE_EXIT_1459,NIFTY24011121900CE.csv,NIFTY24011121400PE.csv,2024-01-08 14:59:00,,,-16432.5
January,08-01-2024,11:45:00,14:59:00,150,21900,21400,20.95,22.95,12.8,45.35,43.9,58.15,65.85,-2137.5,FORCE_EXIT_1459,NIFTY24011121900CE.csv,NIFTY24011121400PE.csv,2024-01-08 14:59:00,,,-18570.0
January,08-01-2024,12:00:00,14:59:00,150,21800,21300,30.95,21.25,24.2,24.35,52.2,48.55,78.3,547.5,FORCE_EXIT_1459,NIFTY24011121800CE.csv,NIFTY24011121300PE.csv,2024-01-08 14:59:00,,,-18022.5
January,08-01-2024,12:15:00,14:59:00,150,21850,21350,22.85,25.15,17.45,33.35,48.0,50.8,72.0,-420.0,FORCE_EXIT_1459,NIFTY24011121850CE.csv,NIFTY24011121350PE.csv,2024-01-08 14:59:00,,,-18442.5
January,08-01-2024,12:30:00,14:59:00,150,21850,21350,21.85,26.8,17.45,33.35,48.65,50.8,72.975,-322.5,FORCE_EXIT_1459,NIFTY24011121850CE.csv,NIFTY24011121350PE.csv,2024-01-08 14:59:00,,,-18765.0
January,08-01-2024,12:45:00,14:59:00,150,21850,21350,23.45,23.1,17.45,33.35,46.55,50.8,69.825,-637.5,FORCE_EXIT_1459,NIFTY24011121850CE.csv,NIFTY24011121350PE.csv,2024-01-08 14:59:00,,,-19402.5
January,08-01-2024,13:00:00,14:59:00,150,21850,21350,21.3,26.6,17.45,33.35,47.9,50.8,71.85,-435.0,FORCE_EXIT_1459,NIFTY24011121850CE.csv,NIFTY24011121350PE.csv,2024-01-08 14:59:00,,,-19837.5
January,08-01-2024,13:15:00,14:59:00,150,21850,21350,21.1,26.0,17.45,33.35,47.1,50.8,70.65,-555.0,FORCE_EXIT_1459,NIFTY24011121850CE.csv,NIFTY24011121350PE.csv,2024-01-08 14:59:00,,,-20392.5
January,08-01-2024,13:30:00,14:59:00,150,21850,21350,23.1,23.15,17.45,33.35,46.25,50.8,69.375,-682.5,FORCE_EXIT_1459,NIFTY24011121850CE.csv,NIFTY24011121350PE.csv,2024-01-08 14:59:00,,,-21075.0
January,08-01-2024,13:45:00,14:59:00,150,21800,21300,26.8,23.05,24.2,24.35,49.85,48.55,74.775,195.0,FORCE_EXIT_1459,NIFTY24011121800CE.csv,NIFTY24011121300PE.csv,2024-01-08 14:59:00,,,-20880.0
January,08-01-2024,14:00:00,14:59:00,150,21850,21350,22.7,22.2,17.45,33.35,44.9,50.8,67.35,-885.0,FORCE_EXIT_1459,NIFTY24011121850CE.csv,NIFTY24011121350PE.csv,2024-01-08 14:59:00,,,-21765.0
January,08-01-2024,14:15:00,14:59:00,150,21850,21350,21.55,22.2,17.45,33.35,43.75,50.8,65.625,-1057.5,FORCE_EXIT_1459,NIFTY24011121850CE.csv,NIFTY24011121350PE.csv,2024-01-08 14:59:00,,,-22822.5
January,08-01-2024,14:30:00,14:59:00,150,21800,21300,26.9,21.65,24.2,24.35,48.55,48.55,72.825,-0.0,FORCE_EXIT_1459,NIFTY24011121800CE.csv,NIFTY24011121300PE.csv,2024-01-08 14:59:00,,,-22822.5
January,08-01-2024,14:45:00,14:59:00,150,21800,21300,24.5,23.25,24.2,24.35,47.75,48.55,71.625,-120.0,FORCE_EXIT_1459,NIFTY24011121800CE.csv,NIFTY24011121300PE.csv,2024-01-08 14:59:00,,,-22942.5
January,09-01-2024,14:00:00,14:21:00,150,21950,21450,9.65,16.0,6.55,31.95,25.65,38.5,38.475,-1927.5,PAIR_STOPLOSS_HIT,NIFTY24011121950CE.csv,NIFTY24011121450PE.csv,2024-01-09 14:21:00,,,-1927.5
January,09-01-2024,10:30:00,14:27:00,150,21950,21450,10.95,18.85,6.0,39.65,29.8,45.65,44.7,-2377.5,PAIR_STOPLOSS_HIT,NIFTY24011121950CE.csv,NIFTY24011121450PE.csv,2024-01-09 14:27:00,,,-4305.0
January,09-01-2024,11:30:00,14:27:00,150,21950,21450,13.4,16.4,6.0,39.65,29.8,45.65,44.7,-2377.5,PAIR_STOPLOSS_HIT,NIFTY24011121950CE.csv,NIFTY24011121450PE.csv,2024-01-09 14:27:00,,,-6682.5
January,09-01-2024,11:45:00,14:27:00,150,21950,21450,14.15,15.7,6.0,39.65,29.85,45.65,44.775,-2370.0,PAIR_STOPLOSS_HIT,NIFTY24011121950CE.csv,NIFTY24011121450PE.csv,2024-01-09 14:27:00,,,-9052.5
January,09-01-2024,12:00:00,14:27:00,150,21950,21450,13.25,16.15,6.0,39.65,29.4,45.65,44.1,-2437.5,PAIR_STOPLOSS_HIT,NIFTY24011121950CE.csv,NIFTY24011121450PE.csv,2024-01-09 14:27:00,,,-11490.0
January,09-01-2024,12:15:00,14:27:00,150,21950,21450,12.4,16.5,6.0,39.65,28.9,45.65,43.35,-2512.5,PAIR_STOPLOSS_HIT,NIFTY24011121950CE.csv,NIFTY24011121450PE.csv,2024-01-09 14:27:00,,,-14002.5
January,09-01-2024,12:30:00,14:27:00,150,21950,21450,14.25,15.5,6.0,39.65,29.75,45.65,44.625,-2385.0,PAIR_STOPLOSS_HIT,NIFTY24011121950CE.csv,NIFTY24011121450PE.csv,2024-01-09 14:27:00,,,-16387.5
January,09-01-2024,12:45:00,14:27:00,150,21950,21450,13.3,15.35,6.0,39.65,28.65,45.65,42.975,-2550.0,PAIR_STOPLOSS_HIT,NIFTY24011121950CE.csv,NIFTY24011121450PE.csv,2024-01-09 14:27:00,,,-18937.5
January,09-01-2024,13:00:00,14:27:00,150,21950,21450,13.55,14.75,6.0,39.65,28.3,45.65,42.45,-2602.5,PAIR_STOPLOSS_HIT,NIFTY24011121950CE.csv,NIFTY24011121450PE.csv,2024-01-09 14:27:00,,,-21540.0
January,09-01-2024,13:15:00,14:27:00,150,21950,21450,13.4,14.1,6.0,39.65,27.5,45.65,41.25,-2722.5,PAIR_STOPLOSS_HIT,NIFTY24011121950CE.csv,NIFTY24011121450PE.csv,2024-01-09 14:27:00,,,-24262.5
January,09-01-2024,13:30:00,14:27:00,150,21950,21450,12.9,13.4,6.0,39.65,26.3,45.65,39.45,-2902.5,PAIR_STOPLOSS_HIT,NIFTY24011121950CE.csv,NIFTY24011121450PE.csv,2024-01-09 14:27:00,,,-27165.0
January,09-01-2024,13:45:00,14:27:00,150,21950,21450,11.4,14.3,6.0,39.65,25.7,45.65,38.55,-2992.5,PAIR_STOPLOSS_HIT,NIFTY24011121950CE.csv,NIFTY24011121450PE.csv,2024-01-09 14:27:00,,,-30157.5
January,09-01-2024,10:45:00,14:28:00,150,21950,21450,16.7,16.3,5.5,44.5,33.0,50.0,49.5,-2550.0,PAIR_STOPLOSS_HIT,NIFTY24011121950CE.csv,NIFTY24011121450PE.csv,2024-01-09 14:28:00,,,-32707.5
January,09-01-2024,11:00:00,14:28:00,150,21950,21450,11.85,18.85,5.5,44.5,30.7,50.0,46.05,-2895.0,PAIR_STOPLOSS_HIT,NIFTY24011121950CE.csv,NIFTY24011121450PE.csv,2024-01-09 14:28:00,,,-35602.5
January,09-01-2024,11:15:00,14:28:00,150,21950,21450,13.75,17.0,5.5,44.5,30.75,50.0,46.125,-2887.5,PAIR_STOPLOSS_HIT,NIFTY24011121950CE.csv,NIFTY24011121450PE.csv,2024-01-09 14:28:00,,,-38490.0
January,09-01-2024,14:15:00,14:28:00,150,21900,21400,12.1,12.7,7.8,32.6,24.8,40.4,37.2,-2340.0,PAIR_STOPLOSS_HIT,NIFTY24011121900CE.csv,NIFTY24011121400PE.csv,2024-01-09 14:28:00,,,-40830.0
January,09-01-2024,09:45:00,14:59:00,150,21850,21350,19.25,15.2,11.75,20.9,34.45,32.65,51.675,270.0,FORCE_EXIT_1459,NIFTY24011121850CE.csv,NIFTY24011121350PE.csv,2024-01-09 14:59:00,,,-40560.0
January,09-01-2024,10:00:00,14:59:00,150,21900,21400,12.7,19.05,8.1,29.3,31.75,37.4,47.625,-847.5,FORCE_EXIT_1459,NIFTY24011121900CE.csv,NIFTY24011121400PE.csv,2024-01-09 14:59:00,,,-41407.5
January,09-01-2024,10:15:00,14:59:00,150,21900,21400,15.1,15.85,8.1,29.3,30.95,37.4,46.425,-967.5,FORCE_EXIT_1459,NIFTY24011121900CE.csv,NIFTY24011121400PE.csv,2024-01-09 14:59:00,,,-42375.0
January,09-01-2024,14:30:00,14:59:00,150,21800,21300,16.35,17.45,17.15,14.55,33.8,31.7,50.7,315.0,FORCE_EXIT_1459,NIFTY24011121800CE.csv,NIFTY24011121300PE.csv,2024-01-09 14:59:00,,,-42060.0
January,09-01-2024,14:45:00,14:59:00,150,21800,21300,15.55,16.5,17.15,14.55,32.05,31.7,48.075,52.5,FORCE_EXIT_1459,NIFTY24011121800CE.csv,NIFTY24011121300PE.csv,2024-01-09 14:59:00,,,-42007.5
January,10-01-2024,09:45:00,14:59:00,150,21750,21350,16.7,24.25,16.95,6.3,40.95,23.25,61.425,2655.0,FORCE_EXIT_1459,NIFTY24011121750CE.csv,NIFTY24011121350PE.csv,2024-01-10 14:59:00,,,2655.0
January,10-01-2024,10:00:00,14:59:00,150,21750,21350,15.1,25.45,16.95,6.3,40.55,23.25,60.825,2595.0,FORCE_EXIT_1459,NIFTY24011121750CE.csv,NIFTY24011121350PE.csv,2024-01-10 14:59:00,,,5250.0
January,10-01-2024,10:15:00,14:59:00,150,21750,21350,16.9,20.2,16.95,6.3,37.1,23.25,55.65,2077.5,FORCE_EXIT_1459,NIFTY24011121750CE.csv,NIFTY24011121350PE.csv,2024-01-10 14:59:00,,,7327.5
January,10-01-2024,10:30:00,14:59:00,150,21750,21350,14.8,23.85,16.95,6.3,38.65,23.25,57.975,2310.0,FORCE_EXIT_1459,NIFTY24011121750CE.csv,NIFTY24011121350PE.csv,2024-01-10 14:59:00,,,9637.5
January,10-01-2024,10:45:00,14:59:00,150,21750,21350,14.1,23.35,16.95,6.3,37.45,23.25,56.175,2130.0,FORCE_EXIT_1459,NIFTY24011121750CE.csv,NIFTY24011121350PE.csv,2024-01-10 14:59:00,,,11767.5
January,10-01-2024,11:00:00,14:59:00,150,21700,21300,18.2,17.9,29.9,4.4,36.1,34.3,54.15,270.0,FORCE_EXIT_1459,NIFTY24011121700CE.csv,NIFTY24011121300PE.csv,2024-01-10 14:59:00,,,12037.5
January,10-01-2024,11:15:00,14:59:00,150,21750,21350,13.0,21.3,16.95,6.3,34.3,23.25,51.45,1657.5,FORCE_EXIT_1459,NIFTY24011121750CE.csv,NIFTY24011121350PE.csv,2024-01-10 14:59:00,,,13695.0
January,10-01-2024,11:30:00,14:59:00,150,21750,21350,12.85,20.4,16.95,6.3,33.25,23.25,49.875,1500.0,FORCE_EXIT_1459,NIFTY24011121750CE.csv,NIFTY24011121350PE.csv,2024-01-10 14:59:00,,,15195.0
January,10-01-2024,11:45:00,14:59:00,150,21750,21350,13.5,19.05,16.95,6.3,32.55,23.25,48.825,1395.0,FORCE_EXIT_1459,NIFTY24011121750CE.csv,NIFTY24011121350PE.csv,2024-01-10 14:59:00,,,16590.0
January,10-01-2024,12:00:00,14:59:00,150,21750,21350,11.9,21.0,16.95,6.3,32.9,23.25,49.35,1447.5,FORCE_EXIT_1459,NIFTY24011121750CE.csv,NIFTY24011121350PE.csv,2024-01-10 14:59:00,,,18037.5
January,10-01-2024,12:15:00,14:59:00,150,21700,21300,15.8,16.25,29.9,4.4,32.05,34.3,48.075,-337.5,FORCE_EXIT_1459,NIFTY24011121700CE.csv,NIFTY24011121300PE.csv,2024-01-10 14:59:00,,,17700.0
January,10-01-2024,12:30:00,14:59:00,150,21700,21300,14.65,16.95,29.9,4.4,31.6,34.3,47.4,-405.0,FORCE_EXIT_1459,NIFTY24011121700CE.csv,NIFTY24011121300PE.csv,2024-01-10 14:59:00,,,17295.0
January,10-01-2024,12:45:00,14:59:00,150,21700,21300,12.65,23.6,29.9,4.4,36.25,34.3,54.375,292.5,FORCE_EXIT_1459,NIFTY24011121700CE.csv,NIFTY24011121300PE.csv,2024-01-10 14:59:00,,,17587.5
January,10-01-2024,13:00:00,14:59:00,150,21700,21300,12.5,18.55,29.9,4.4,31.05,34.3,46.575,-487.5,FORCE_EXIT_1459,NIFTY24011121700CE.csv,NIFTY24011121300PE.csv,2024-01-10 14:59:00,,,17100.0
January,10-01-2024,13:15:00,14:59:00,150,21700,21300,14.35,14.2,29.9,4.4,28.55,34.3,42.825,-862.5,FORCE_EXIT_1459,NIFTY24011121700CE.csv,NIFTY24011121300PE.csv,2024-01-10 14:59:00,,,16237.5
January,10-01-2024,13:30:00,14:59:00,150,21700,21300,12.6,16.15,29.9,4.4,28.75,34.3,43.125,-832.5,FORCE_EXIT_1459,NIFTY24011121700CE.csv,NIFTY24011121300PE.csv,2024-01-10 14:59:00,,,15405.0
January,10-01-2024,13:45:00,14:59:00,150,21700,21300,12.3,16.35,29.9,4.4,28.65,34.3,42.975,-847.5,FORCE_EXIT_1459,NIFTY24011121700CE.csv,NIFTY24011121300PE.csv,2024-01-10 14:59:00,,,14557.5
January,10-01-2024,14:00:00,14:59:00,150,21750,21350,11.0,14.65,16.95,6.3,25.65,23.25,38.475,360.0,FORCE_EXIT_1459,NIFTY24011121750CE.csv,NIFTY24011121350PE.csv,2024-01-10 14:59:00,,,14917.5
January,10-01-2024,14:15:00,14:59:00,150,21750,21350,10.3,15.45,16.95,6.3,25.75,23.25,38.625,375.0,FORCE_EXIT_1459,NIFTY24011121750CE.csv,NIFTY24011121350PE.csv,2024-01-10 14:59:00,,,15292.5
January,10-01-2024,14:30:00,14:59:00,150,21750,21350,8.8,15.05,16.95,6.3,23.85,23.25,35.775,90.0,FORCE_EXIT_1459,NIFTY24011121750CE.csv,NIFTY24011121350PE.csv,2024-01-10 14:59:00,,,15382.5
January,10-01-2024,14:45:00,14:59:00,150,21750,21350,13.15,9.55,16.95,6.3,22.7,23.25,34.05,-82.5,FORCE_EXIT_1459,NIFTY24011121750CE.csv,NIFTY24011121350PE.csv,2024-01-10 14:59:00,,,15300.0
January,11-01-2024,14:00:00,14:09:00,150,21800,21500,0.85,0.9,0.8,2.1,1.75,2.9,2.625,-172.5,PAIR_STOPLOSS_HIT,NIFTY24011121800CE.csv,NIFTY24011121500PE.csv,2024-01-11 14:09:00,,,-172.5
January,11-01-2024,13:30:00,14:10:00,150,21800,21500,1.05,1.2,0.75,2.65,2.25,3.4,3.375,-172.5,PAIR_STOPLOSS_HIT,NIFTY24011121800CE.csv,NIFTY24011121500PE.csv,2024-01-11 14:10:00,,,-345.0
January,11-01-2024,13:45:00,14:10:00,150,21800,21500,0.85,1.25,0.75,2.65,2.1,3.4,3.15,-195.0,PAIR_STOPLOSS_HIT,NIFTY24011121800CE.csv,NIFTY24011121500PE.csv,2024-01-11 14:10:00,,,-540.0
January,11-01-2024,13:00:00,14:13:00,150,21800,21500,1.9,1.1,0.55,4.0,3.0,4.55,4.5,-232.5,PAIR_STOPLOSS_HIT,NIFTY24011121800CE.csv,NIFTY24011121500PE.csv,2024-01-11 14:13:00,,,-772.5
January,11-01-2024,13:15:00,14:13:00,150,21800,21500,1.7,1.15,0.55,4.0,2.85,4.55,4.275,-255.0,PAIR_STOPLOSS_HIT,NIFTY24011121800CE.csv,NIFTY24011121500PE.csv,2024-01-11 14:13:00,,,-1027.5
January,11-01-2024,10:15:00,14:14:00,150,21850,21550,2.0,4.75,0.45,9.7,6.75,10.15,10.125,-510.0,PAIR_STOPLOSS_HIT,NIFTY24011121850CE.csv,NIFTY24011121550PE.csv,2024-01-11 14:14:00,,,-1537.5
January,11-01-2024,12:15:00,14:14:00,150,21800,21500,1.55,1.75,0.6,4.95,3.3,5.55,4.95,-337.5,PAIR_STOPLOSS_HIT,NIFTY24011121800CE.csv,NIFTY24011121500PE.csv,2024-01-11 14:14:00,,,-1875.0
January,11-01-2024,12:30:00,14:14:00,150,21800,21500,1.8,1.45,0.6,4.95,3.25,5.55,4.875,-345.0,PAIR_STOPLOSS_HIT,NIFTY24011121800CE.csv,NIFTY24011121500PE.csv,2024-01-11 14:14:00,,,-2220.0
January,11-01-2024,12:45:00,14:14:00,150,21800,21500,1.8,1.3,0.6,4.95,3.1,5.55,4.65,-367.5,PAIR_STOPLOSS_HIT,NIFTY24011121800CE.csv,NIFTY24011121500PE.csv,2024-01-11 14:14:00,,,-2587.5
January,11-01-2024,09:45:00,14:59:00,150,21850,21550,2.3,7.5,0.2,0.45,9.8,0.65,14.7,1372.5,FORCE_EXIT_1459,NIFTY24011121850CE.csv,NIFTY24011121550PE.csv,2024-01-11 14:59:00,,,-1215.0
January,11-01-2024,10:00:00,14:59:00,150,21800,21500,4.0,4.8,0.2,0.25,8.8,0.45,13.2,1252.5,FORCE_EXIT_1459,NIFTY24011121800CE.csv,NIFTY24011121500PE.csv,2024-01-11 14:59:00,,,37.5
January,11-01-2024,10:30:00,14:59:00,150,21800,21500,2.7,3.3,0.2,0.25,6.0,0.45,9.0,832.5,FORCE_EXIT_1459,NIFTY24011121800CE.csv,NIFTY24011121500PE.csv,2024-01-11 14:59:00,,,870.0
January,11-01-2024,10:45:00,14:59:00,150,21800,21500,2.8,2.55,0.2,0.25,5.35,0.45,8.025,735.0,FORCE_EXIT_1459,NIFTY24011121800CE.csv,NIFTY24011121500PE.csv,2024-01-11 14:59:00,,,1605.0
January,11-01-2024,11:00:00,14:59:00,150,21800,21500,2.15,2.8,0.2,0.25,4.95,0.45,7.425,675.0,FORCE_EXIT_1459,NIFTY24011121800CE.csv,NIFTY24011121500PE.csv,2024-01-11 14:59:00,,,2280.0
January,11-01-2024,11:15:00,14:59:00,150,21800,21500,2.1,2.9,0.2,0.25,5.0,0.45,7.5,682.5,FORCE_EXIT_1459,NIFTY24011121800CE.csv,NIFTY24011121500PE.csv,2024-01-11 14:59:00,,,2962.5
January,11-01-2024,11:30:00,14:59:00,150,21800,21500,2.1,3.0,0.2,0.25,5.1,0.45,7.65,697.5,FORCE_EXIT_1459,NIFTY24011121800CE.csv,NIFTY24011121500PE.csv,2024-01-11 14:59:00,,,3660.0
January,11-01-2024,11:45:00,14:59:00,150,21800,21500,2.25,2.3,0.2,0.25,4.55,0.45,6.825,615.0,FORCE_EXIT_1459,NIFTY24011121800CE.csv,NIFTY24011121500PE.csv,2024-01-11 14:59:00,,,4275.0
January,11-01-2024,12:00:00,14:59:00,150,21800,21500,2.0,1.95,0.2,0.25,3.95,0.45,5.925,525.0,FORCE_EXIT_1459,NIFTY24011121800CE.csv,NIFTY24011121500PE.csv,2024-01-11 14:59:00,,,4800.0
January,11-01-2024,14:15:00,14:59:00,150,21750,21450,0.9,1.9,0.35,0.2,2.8,0.55,4.2,337.5,FORCE_EXIT_1459,NIFTY24011121750CE.csv,NIFTY24011121450PE.csv,2024-01-11 14:59:00,,,5137.5
January,11-01-2024,14:30:00,14:59:00,150,21800,21500,0.65,0.75,0.2,0.25,1.4,0.45,2.1,142.5,FORCE_EXIT_1459,NIFTY24011121800CE.csv,NIFTY24011121500PE.csv,2024-01-11 14:59:00,,,5280.0
January,11-01-2024,14:45:00,14:59:00,150,21800,21500,0.3,0.4,0.2,0.25,0.7,0.45,1.05,37.5,FORCE_EXIT_1459,NIFTY24011121800CE.csv,NIFTY24011121500PE.csv,2024-01-11 14:59:00,,,5317.5
January,12-01-2024,09:45:00,12:55:00,150,22050,21450,27.55,35.45,69.2,28.0,63.0,97.2,94.5,-5130.0,PAIR_STOPLOSS_HIT,NIFTY24011822050CE.csv,NIFTY24011821450PE.csv,2024-01-12 12:55:00,,,-5130.0
January,12-01-2024,10:00:00,12:55:00,150,22050,21450,29.05,33.4,69.2,28.0,62.45,97.2,93.675,-5212.5,PAIR_STOPLOSS_HIT,NIFTY24011822050CE.csv,NIFTY24011821450PE.csv,2024-01-12 12:55:00,,,-10342.5
January,12-01-2024,10:15:00,14:36:00,150,22100,21500,34.2,38.05,73.65,29.35,72.25,103.0,108.375,-4253.46,MAX_LOSS_EXIT_STRICT,NIFTY24011822100CE.csv,NIFTY24011821500PE.csv,2024-01-12 14:36:00,-4612.5,,-14595.96
January,12-01-2024,10:30:00,14:36:00,150,22100,21500,37.8,37.95,73.65,29.35,75.75,103.0,113.625,-3769.33,MAX_LOSS_EXIT_STRICT,NIFTY24011822100CE.csv,NIFTY24011821500PE.csv,2024-01-12 14:36:00,-4087.5,,-18365.29
January,12-01-2024,10:45:00,14:36:00,150,22100,21500,39.5,37.3,73.65,29.35,76.8,103.0,115.2,-3624.09,MAX_LOSS_EXIT_STRICT,NIFTY24011822100CE.csv,NIFTY24011821500PE.csv,2024-01-12 14:36:00,-3930.0,,-21989.38
January,12-01-2024,11:00:00,14:36:00,150,22150,21550,35.4,41.7,57.0,34.6,77.1,91.6,115.65,-2005.7,MAX_LOSS_EXIT_STRICT,NIFTY24011822150CE.csv,NIFTY24011821550PE.csv,2024-01-12 14:36:00,-2175.0,,-23995.08
January,12-01-2024,11:15:00,14:36:00,150,22150,21550,29.9,44.9,57.0,34.6,74.8,91.6,112.2,-2323.84,MAX_LOSS_EXIT_STRICT,NIFTY24011822150CE.csv,NIFTY24011821550PE.csv,2024-01-12 14:36:00,-2520.0,,-26318.920000000002
January,12-01-2024,11:30:00,14:36:00,150,22150,21550,31.65,44.05,57.0,34.6,75.7,91.6,113.55,-2199.35,MAX_LOSS_EXIT_STRICT,NIFTY24011822150CE.csv,NIFTY24011821550PE.csv,2024-01-12 14:36:00,-2385.0,,-28518.27
January,12-01-2024,11:45:00,14:36:00,150,22150,21550,32.5,43.3,57.0,34.6,75.8,91.6,113.7,-2185.52,MAX_LOSS_EXIT_STRICT,NIFTY24011822150CE.csv,NIFTY24011821550PE.csv,2024-01-12 14:36:00,-2370.0,,-30703.79
January,12-01-2024,12:00:00,14:36:00,150,22150,21550,31.55,43.8,57.0,34.6,75.35,91.6,113.025,-2247.77,MAX_LOSS_EXIT_STRICT,NIFTY24011822150CE.csv,NIFTY24011821550PE.csv,2024-01-12 14:36:00,-2437.5,,-32951.56
January,12-01-2024,12:15:00,14:36:00,150,22150,21550,29.1,44.35,57.0,34.6,73.45,91.6,110.175,-2510.58,MAX_LOSS_EXIT_STRICT,NIFTY24011822150CE.csv,NIFTY24011821550PE.csv,2024-01-12 14:36:00,-2722.5,,-35462.14
January,12-01-2024,12:30:00,14:36:00,150,22150,21550,29.6,43.05,57.0,34.6,72.65,91.6,108.975,-2621.24,MAX_LOSS_EXIT_STRICT,NIFTY24011822150CE.csv,NIFTY24011821550PE.csv,2024-01-12 14:36:00,-2842.5,,-38083.38
January,12-01-2024,12:45:00,14:36:00,150,22150,21550,28.65,43.1,57.0,34.6,71.75,91.6,107.625,-2745.73,MAX_LOSS_EXIT_STRICT,NIFTY24011822150CE.csv,NIFTY24011821550PE.csv,2024-01-12 14:36:00,-2977.5,,-40829.11
January,12-01-2024,13:00:00,14:36:00,150,22150,21550,37.5,41.0,57.0,34.6,78.5,91.6,117.75,-1812.04,MAX_LOSS_EXIT_STRICT,NIFTY24011822150CE.csv,NIFTY24011821550PE.csv,2024-01-12 14:36:00,-1965.0,,-42641.15
January,12-01-2024,13:15:00,14:36:00,150,22150,21550,37.25,38.4,57.0,34.6,75.65,91.6,113.475,-2206.27,MAX_LOSS_EXIT_STRICT,NIFTY24011822150CE.csv,NIFTY24011821550PE.csv,2024-01-12 14:36:00,-2392.5,,-44847.42
January,12-01-2024,13:30:00,14:36:00,150,22150,21550,38.05,38.55,57.0,34.6,76.6,91.6,114.9,-2074.86,MAX_LOSS_EXIT_STRICT,NIFTY24011822150CE.csv,NIFTY24011821550PE.csv,2024-01-12 14:36:00,-2250.0,,-46922.28
January,12-01-2024,13:45:00,14:36:00,150,22200,21600,33.5,42.85,43.25,40.7,76.35,83.95,114.525,-1051.26,MAX_LOSS_EXIT_STRICT,NIFTY24011822200CE.csv,NIFTY24011821600PE.csv,2024-01-12 14:36:00,-1140.0,,-47973.54
January,12-01-2024,14:00:00,14:36:00,150,22200,21600,34.85,44.85,43.25,40.7,79.7,83.95,119.55,-587.88,MAX_LOSS_EXIT_STRICT,NIFTY24011822200CE.csv,NIFTY24011821600PE.csv,2024-01-12 14:36:00,-637.5,,-48561.42
January,12-01-2024,14:15:00,14:36:00,150,22200,21600,32.5,44.95,43.25,40.7,77.45,83.95,116.175,-899.11,MAX_LOSS_EXIT_STRICT,NIFTY24011822200CE.csv,NIFTY24011821600PE.csv,2024-01-12 14:36:00,-975.0,,-49460.53
January,12-01-2024,14:30:00,14:36:00,150,22200,21600,37.05,43.0,43.25,40.7,80.05,83.95,120.075,-539.46,MAX_LOSS_EXIT_STRICT,NIFTY24011822200CE.csv,NIFTY24011821600PE.csv,2024-01-12 14:36:00,-585.0,,-49999.99
January,15-01-2024,09:45:00,14:59:00,150,22300,21800,33.1,44.15,37.5,31.7,77.25,69.2,115.875,1207.5,FORCE_EXIT_1459,NIFTY24011822300CE.csv,NIFTY24011821800PE.csv,2024-01-15 14:59:00,,,1207.5
January,15-01-2024,10:00:00,14:59:00,150,22200,21700,41.7,40.8,72.2,21.85,82.5,94.05,123.75,-1732.5,FORCE_EXIT_1459,NIFTY24011822200CE.csv,NIFTY24011821700PE.csv,2024-01-15 14:59:00,,,-525.0
January,15-01-2024,10:15:00,14:59:00,150,22250,21750,36.35,41.3,52.9,26.15,77.65,79.05,116.475,-210.0,FORCE_EXIT_1459,NIFTY24011822250CE.csv,NIFTY24011821750PE.csv,2024-01-15 14:59:00,,,-735.0
January,15-01-2024,10:30:00,14:59:00,150,22250,21750,37.9,39.35,52.9,26.15,77.25,79.05,115.875,-270.0,FORCE_EXIT_1459,NIFTY24011822250CE.csv,NIFTY24011821750PE.csv,2024-01-15 14:59:00,,,-1005.0
January,15-01-2024,10:45:00,14:59:00,150,22300,21800,27.1,46.85,37.5,31.7,73.95,69.2,110.925,712.5,FORCE_EXIT_1459,NIFTY24011822300CE.csv,NIFTY24011821800PE.csv,2024-01-15 14:59:00,,,-292.5
January,15-01-2024,11:00:00,14:59:00,150,22300,21800,28.65,43.05,37.5,31.7,71.7,69.2,107.55,375.0,FORCE_EXIT_1459,NIFTY24011822300CE.csv,NIFTY24011821800PE.csv,2024-01-15 14:59:00,,,82.5
January,15-01-2024,11:15:00,14:59:00,150,22300,21800,28.3,43.1,37.5,31.7,71.4,69.2,107.1,330.0,FORCE_EXIT_1459,NIFTY24011822300CE.csv,NIFTY24011821800PE.csv,2024-01-15 14:59:00,,,412.5
January,15-01-2024,11:30:00,14:59:00,150,22300,21800,30.3,41.8,37.5,31.7,72.1,69.2,108.15,435.0,FORCE_EXIT_1459,NIFTY24011822300CE.csv,NIFTY24011821800PE.csv,2024-01-15 14:59:00,,,847.5
January,15-01-2024,11:45:00,14:59:00,150,22300,21800,29.3,41.65,37.5,31.7,70.95,69.2,106.425,262.5,FORCE_EXIT_1459,NIFTY24011822300CE.csv,NIFTY24011821800PE.csv,2024-01-15 14:59:00,,,1110.0
January,15-01-2024,12:00:00,14:59:00,150,22300,21800,29.75,39.5,37.5,31.7,69.25,69.2,103.875,7.5,FORCE_EXIT_1459,NIFTY24011822300CE.csv,NIFTY24011821800PE.csv,2024-01-15 14:59:00,,,1117.5
January,15-01-2024,12:15:00,14:59:00,150,22300,21800,30.0,39.0,37.5,31.7,69.0,69.2,103.5,-30.0,FORCE_EXIT_1459,NIFTY24011822300CE.csv,NIFTY24011821800PE.csv,2024-01-15 14:59:00,,,1087.5
January,15-01-2024,12:30:00,14:59:00,150,22300,21800,31.35,38.15,37.5,31.7,69.5,69.2,104.25,45.0,FORCE_EXIT_1459,NIFTY24011822300CE.csv,NIFTY24011821800PE.csv,2024-01-15 14:59:00,,,1132.5
January,15-01-2024,12:45:00,14:59:00,150,22300,21800,30.15,38.4,37.5,31.7,68.55,69.2,102.825,-97.5,FORCE_EXIT_1459,NIFTY24011822300CE.csv,NIFTY24011821800PE.csv,2024-01-15 14:59:00,,,1035.0
January,15-01-2024,13:00:00,14:59:00,150,22300,21800,30.25,37.6,37.5,31.7,67.85,69.2,101.775,-202.5,FORCE_EXIT_1459,NIFTY24011822300CE.csv,NIFTY24011821800PE.csv,2024-01-15 14:59:00,,,832.5
January,15-01-2024,13:15:00,14:59:00,150,22300,21800,29.7,37.6,37.5,31.7,67.3,69.2,100.95,-285.0,FORCE_EXIT_1459,NIFTY24011822300CE.csv,NIFTY24011821800PE.csv,2024-01-15 14:59:00,,,547.5
January,15-01-2024,13:30:00,14:59:00,150,22300,21800,29.2,38.25,37.5,31.7,67.45,69.2,101.175,-262.5,FORCE_EXIT_1459,NIFTY24011822300CE.csv,NIFTY24011821800PE.csv,2024-01-15 14:59:00,,,285.0
January,15-01-2024,13:45:00,14:59:00,150,22300,21800,28.4,38.65,37.5,31.7,67.05,69.2,100.575,-322.5,FORCE_EXIT_1459,NIFTY24011822300CE.csv,NIFTY24011821800PE.csv,2024-01-15 14:59:00,,,-37.5
January,15-01-2024,14:00:00,14:59:00,150,22300,21800,30.35,36.35,37.5,31.7,66.7,69.2,100.05,-375.0,FORCE_EXIT_1459,NIFTY24011822300CE.csv,NIFTY24011821800PE.csv,2024-01-15 14:59:00,,,-412.5
January,15-01-2024,14:15:00,14:59:00,150,22300,21800,31.0,37.3,37.5,31.7,68.3,69.2,102.45,-135.0,FORCE_EXIT_1459,NIFTY24011822300CE.csv,NIFTY24011821800PE.csv,2024-01-15 14:59:00,,,-547.5
January,15-01-2024,14:30:00,14:59:00,150,22300,21800,30.65,36.9,37.5,31.7,67.55,69.2,101.325,-247.5,FORCE_EXIT_1459,NIFTY24011822300CE.csv,NIFTY24011821800PE.csv,2024-01-15 14:59:00,,,-795.0
January,15-01-2024,14:45:00,14:59:00,150,22300,21800,30.65,34.4,37.5,31.7,65.05,69.2,97.575,-622.5,FORCE_EXIT_1459,NIFTY24011822300CE.csv,NIFTY24011821800PE.csv,2024-01-15 14:59:00,,,-1417.5
January,16-01-2024,12:00:00,13:36:00,150,22350,21850,15.3,27.75,8.3,56.4,43.05,64.7,64.575,-3247.5,PAIR_STOPLOSS_HIT,NIFTY24011822350CE.csv,NIFTY24011821850PE.csv,2024-01-16 13:36:00,,,-3247.5
January,16-01-2024,12:30:00,13:36:00,150,22350,21850,13.2,29.8,8.3,56.4,43.0,64.7,64.5,-3255.0,PAIR_STOPLOSS_HIT,NIFTY24011822350CE.csv,NIFTY24011821850PE.csv,2024-01-16 13:36:00,,,-6502.5
January,16-01-2024,09:45:00,14:59:00,150,22300,21800,21.4,31.35,13.75,23.8,52.75,37.55,79.125,2280.0,FORCE_EXIT_1459,NIFTY24011822300CE.csv,NIFTY24011821800PE.csv,2024-01-16 14:59:00,,,-4222.5
January,16-01-2024,10:00:00,14:59:00,150,22300,21800,21.95,30.45,13.75,23.8,52.4,37.55,78.6,2227.5,FORCE_EXIT_1459,NIFTY24011822300CE.csv,NIFTY24011821800PE.csv,2024-01-16 14:59:00,,,-1995.0
January,16-01-2024,10:15:00,14:59:00,150,22350,21850,17.1,34.1,9.1,30.35,51.2,39.45,76.8,1762.5,FORCE_EXIT_1459,NIFTY24011822350CE.csv,NIFTY24011821850PE.csv,2024-01-16 14:59:00,,,-232.5
January,16-01-2024,10:30:00,14:59:00,150,22350,21850,16.65,33.95,9.1,30.35,50.6,39.45,75.9,1672.5,FORCE_EXIT_1459,NIFTY24011822350CE.csv,NIFTY24011821850PE.csv,2024-01-16 14:59:00,,,1440.0
January,16-01-2024,10:45:00,14:59:00,150,22350,21850,17.5,30.75,9.1,30.35,48.25,39.45,72.375,1320.0,FORCE_EXIT_1459,NIFTY24011822350CE.csv,NIFTY24011821850PE.csv,2024-01-16 14:59:00,,,2760.0
January,16-01-2024,11:00:00,14:59:00,150,22350,21850,18.15,29.6,9.1,30.35,47.75,39.45,71.625,1245.0,FORCE_EXIT_1459,NIFTY24011822350CE.csv,NIFTY24011821850PE.csv,2024-01-16 14:59:00,,,4005.0
January,16-01-2024,11:15:00,14:59:00,150,22350,21850,19.15,27.7,9.1,30.35,46.85,39.45,70.275,1110.0,FORCE_EXIT_1459,NIFTY24011822350CE.csv,NIFTY24011821850PE.csv,2024-01-16 14:59:00,,,5115.0
January,16-01-2024,11:30:00,14:59:00,150,22350,21850,16.0,30.35,9.1,30.35,46.35,39.45,69.525,1035.0,FORCE_EXIT_1459,NIFTY24011822350CE.csv,NIFTY24011821850PE.csv,2024-01-16 14:59:00,,,6150.0
January,16-01-2024,11:45:00,14:59:00,150,22350,21850,13.25,32.85,9.1,30.35,46.1,39.45,69.15,997.5,FORCE_EXIT_1459,NIFTY24011822350CE.csv,NIFTY24011821850PE.csv,2024-01-16 14:59:00,,,7147.5
January,16-01-2024,12:15:00,14:59:00,150,22300,21800,18.7,26.85,13.75,23.8,45.55,37.55,68.325,1200.0,FORCE_EXIT_1459,NIFTY24011822300CE.csv,NIFTY24011821800PE.csv,2024-01-16 14:59:00,,,8347.5
January,16-01-2024,12:45:00,14:59:00,150,22300,21800,17.9,25.65,13.75,23.8,43.55,37.55,65.325,900.0,FORCE_EXIT_1459,NIFTY24011822300CE.csv,NIFTY24011821800PE.csv,2024-01-16 14:59:00,,,9247.5
January,16-01-2024,13:00:00,14:59:00,150,22300,21800,14.55,30.25,13.75,23.8,44.8,37.55,67.2,1087.5,FORCE_EXIT_1459,NIFTY24011822300CE.csv,NIFTY24011821800PE.csv,2024-01-16 14:59:00,,,10335.0
January,16-01-2024,13:15:00,14:59:00,150,22250,21750,19.15,24.6,20.2,18.75,43.75,38.95,65.625,720.0,FORCE_EXIT_1459,NIFTY24011822250CE.csv,NIFTY24011821750PE.csv,2024-01-16 14:59:00,,,11055.0
January,16-01-2024,13:30:00,14:59:00,150,22250,21750,20.5,24.4,20.2,18.75,44.9,38.95,67.35,892.5,FORCE_EXIT_1459,NIFTY24011822250CE.csv,NIFTY24011821750PE.csv,2024-01-16 14:59:00,,,11947.5
January,16-01-2024,13:45:00,14:59:00,150,22250,21750,18.7,26.4,20.2,18.75,45.1,38.95,67.65,922.5,FORCE_EXIT_1459,NIFTY24011822250CE.csv,NIFTY24011821750PE.csv,2024-01-16 14:59:00,,,12870.0
January,16-01-2024,14:00:00,14:59:00,150,22300,21800,13.85,27.65,13.75,23.8,41.5,37.55,62.25,592.5,FORCE_EXIT_1459,NIFTY24011822300CE.csv,NIFTY24011821800PE.csv,2024-01-16 14:59:00,,,13462.5
January,16-01-2024,14:15:00,14:59:00,150,22300,21800,14.7,25.6,13.75,23.8,40.3,37.55,60.45,412.5,FORCE_EXIT_1459,NIFTY24011822300CE.csv,NIFTY24011821800PE.csv,2024-01-16 14:59:00,,,13875.0
January,16-01-2024,14:30:00,14:59:00,150,22300,21800,15.5,23.9,13.75,23.8,39.4,37.55,59.1,277.5,FORCE_EXIT_1459,NIFTY24011822300CE.csv,NIFTY24011821800PE.csv,2024-01-16 14:59:00,,,14152.5
January,16-01-2024,14:45:00,14:59:00,150,22300,21800,14.2,23.7,13.75,23.8,37.9,37.55,56.85,52.5,FORCE_EXIT_1459,NIFTY24011822300CE.csv,NIFTY24011821800PE.csv,2024-01-16 14:59:00,,,14205.0
January,17-01-2024,10:30:00,11:39:00,150,22000,21600,15.5,23.3,13.0,46.35,38.8,59.35,58.2,-3082.5,PAIR_STOPLOSS_HIT,NIFTY24011822000CE.csv,NIFTY24011821600PE.csv,2024-01-17 11:39:00,,,-3082.5
January,17-01-2024,09:45:00,11:40:00,150,22050,21650,17.0,32.7,9.55,65.35,49.7,74.9,74.55,-3780.0,PAIR_STOPLOSS_HIT,NIFTY24011822050CE.csv,NIFTY24011821650PE.csv,2024-01-17 11:40:00,,,-6862.5
January,17-01-2024,10:00:00,11:41:00,150,22000,21600,18.25,25.1,12.6,52.85,43.35,65.45,65.025,-3315.0,PAIR_STOPLOSS_HIT,NIFTY24011822000CE.csv,NIFTY24011821600PE.csv,2024-01-17 11:41:00,,,-10177.5
January,17-01-2024,10:15:00,11:41:00,150,22000,21600,17.1,24.35,12.6,52.85,41.45,65.45,62.175,-3600.0,PAIR_STOPLOSS_HIT,NIFTY24011822000CE.csv,NIFTY24011821600PE.csv,2024-01-17 11:41:00,,,-13777.5
January,17-01-2024,10:45:00,12:02:00,150,21950,21550,18.65,22.9,14.8,50.2,41.55,65.0,62.325,-3517.5,PAIR_STOPLOSS_HIT,NIFTY24011821950CE.csv,NIFTY24011821550PE.csv,2024-01-17 12:02:00,,,-17295.0
January,17-01-2024,11:00:00,12:02:00,150,21950,21550,19.3,22.05,14.8,50.2,41.35,65.0,62.025,-3547.5,PAIR_STOPLOSS_HIT,NIFTY24011821950CE.csv,NIFTY24011821550PE.csv,2024-01-17 12:02:00,,,-20842.5
January,17-01-2024,11:15:00,12:02:00,150,21950,21550,18.8,22.25,14.8,50.2,41.05,65.0,61.575,-3592.5,PAIR_STOPLOSS_HIT,NIFTY24011821950CE.csv,NIFTY24011821550PE.csv,2024-01-17 12:02:00,,,-24435.0
January,17-01-2024,11:30:00,12:02:00,150,21950,21550,18.95,23.5,14.8,50.2,42.45,65.0,63.675,-3382.5,PAIR_STOPLOSS_HIT,NIFTY24011821950CE.csv,NIFTY24011821550PE.csv,2024-01-17 12:02:00,,,-27817.5
January,17-01-2024,11:45:00,14:59:00,150,21900,21500,22.5,29.75,8.6,52.4,52.25,61.0,78.375,-1312.5,FORCE_EXIT_1459,NIFTY24011821900CE.csv,NIFTY24011821500PE.csv,2024-01-17 14:59:00,,,-29130.0
January,17-01-2024,12:00:00,14:59:00,150,21850,21450,29.65,23.95,11.45,38.2,53.6,49.65,80.4,592.5,FORCE_EXIT_1459,NIFTY24011821850CE.csv,NIFTY24011821450PE.csv,2024-01-17 14:59:00,,,-28537.5
January,17-01-2024,12:15:00,14:59:00,150,21900,21500,24.35,31.35,8.6,52.4,55.7,61.0,83.55,-795.0,FORCE_EXIT_1459,NIFTY24011821900CE.csv,NIFTY24011821500PE.csv,2024-01-17 14:59:00,,,-29332.5
January,17-01-2024,12:30:00,14:59:00,150,21850,21450,28.95,26.95,11.45,38.2,55.9,49.65,83.85,937.5,FORCE_EXIT_1459,NIFTY24011821850CE.csv,NIFTY24011821450PE.csv,2024-01-17 14:59:00,,,-28395.0
January,17-01-2024,12:45:00,14:59:00,150,21850,21450,29.5,28.25,11.45,38.2,57.75,49.65,86.625,1215.0,FORCE_EXIT_1459,NIFTY24011821850CE.csv,NIFTY24011821450PE.csv,2024-01-17 14:59:00,,,-27180.0
January,17-01-2024,13:00:00,14:59:00,150,21850,21450,28.95,30.35,11.45,38.2,59.3,49.65,88.95,1447.5,FORCE_EXIT_1459,NIFTY24011821850CE.csv,NIFTY24011821450PE.csv,2024-01-17 14:59:00,,,-25732.5
January,17-01-2024,13:15:00,14:59:00,150,21850,21450,28.3,30.9,11.45,38.2,59.2,49.65,88.8,1432.5,FORCE_EXIT_1459,NIFTY24011821850CE.csv,NIFTY24011821450PE.csv,2024-01-17 14:59:00,,,-24300.0
January,17-01-2024,13:30:00,14:59:00,150,21850,21450,27.65,29.85,11.45,38.2,57.5,49.65,86.25,1177.5,FORCE_EXIT_1459,NIFTY24011821850CE.csv,NIFTY24011821450PE.csv,2024-01-17 14:59:00,,,-23122.5
January,17-01-2024,13:45:00,14:59:00,150,21850,21450,25.45,24.35,11.45,38.2,49.8,49.65,74.7,22.5,FORCE_EXIT_1459,NIFTY24011821850CE.csv,NIFTY24011821450PE.csv,2024-01-17 14:59:00,,,-23100.0
January,17-01-2024,14:00:00,14:59:00,150,21850,21450,22.85,23.25,11.45,38.2,46.1,49.65,69.15,-532.5,FORCE_EXIT_1459,NIFTY24011821850CE.csv,NIFTY24011821450PE.csv,2024-01-17 14:59:00,,,-23632.5
January,17-01-2024,14:15:00,14:59:00,150,21850,21450,20.95,20.55,11.45,38.2,41.5,49.65,62.25,-1222.5,FORCE_EXIT_1459,NIFTY24011821850CE.csv,NIFTY24011821450PE.csv,2024-01-17 14:59:00,,,-24855.0
January,17-01-2024,14:30:00,14:59:00,150,21800,21400,19.5,21.05,16.45,26.7,40.55,43.15,60.825,-390.0,FORCE_EXIT_1459,NIFTY24011821800CE.csv,NIFTY24011821400PE.csv,2024-01-17 14:59:00,,,-25245.0
January,17-01-2024,14:45:00,14:59:00,150,21750,21350,23.4,19.65,23.1,18.3,43.05,41.4,64.575,247.5,FORCE_EXIT_1459,NIFTY24011821750CE.csv,NIFTY24011821350PE.csv,2024-01-17 14:59:00,,,-24997.5
January,18-01-2024,09:45:00,09:52:00,150,21550,21250,7.15,18.15,4.3,39.0,25.3,43.3,37.95,-2700.0,PAIR_STOPLOSS_HIT,NIFTY24011821550CE.csv,NIFTY24011821250PE.csv,2024-01-18 09:52:00,,,-2700.0
January,18-01-2024,10:00:00,10:09:00,150,21450,21150,10.8,13.45,38.6,5.8,24.25,44.4,36.375,-3022.5,PAIR_STOPLOSS_HIT,NIFTY24011821450CE.csv,NIFTY24011821150PE.csv,2024-01-18 10:09:00,,,-5722.5
January,18-01-2024,10:15:00,10:48:00,150,21500,21200,11.35,13.9,33.6,4.3,25.25,37.9,37.875,-1897.5,PAIR_STOPLOSS_HIT,NIFTY24011821500CE.csv,NIFTY24011821200PE.csv,2024-01-18 10:48:00,,,-7620.0
January,18-01-2024,10:30:00,14:59:00,150,21550,21250,10.5,8.85,0.4,0.25,19.35,0.65,29.025,2805.0,FORCE_EXIT_1459,NIFTY24011821550CE.csv,NIFTY24011821250PE.csv,2024-01-18 14:59:00,,,-4815.0
January,18-01-2024,10:45:00,14:59:00,150,21600,21300,6.45,9.8,0.35,0.3,16.25,0.65,24.375,2340.0,FORCE_EXIT_1459,NIFTY24011821600CE.csv,NIFTY24011821300PE.csv,2024-01-18 14:59:00,,,-2475.0
January,18-01-2024,11:00:00,14:59:00,150,21600,21300,7.85,7.5,0.35,0.3,15.35,0.65,23.025,2205.0,FORCE_EXIT_1459,NIFTY24011821600CE.csv,NIFTY24011821300PE.csv,2024-01-18 14:59:00,,,-270.0
January,18-01-2024,11:15:00,14:59:00,150,21650,21350,4.5,9.0,0.2,0.35,13.5,0.55,20.25,1942.5,FORCE_EXIT_1459,NIFTY24011821650CE.csv,NIFTY24011821350PE.csv,2024-01-18 14:59:00,,,1672.5
January,18-01-2024,11:30:00,14:59:00,150,21650,21350,3.65,7.95,0.2,0.35,11.6,0.55,17.4,1657.5,FORCE_EXIT_1459,NIFTY24011821650CE.csv,NIFTY24011821350PE.csv,2024-01-18 14:59:00,,,3330.0
January,18-01-2024,11:45:00,14:59:00,150,21600,21300,4.8,5.6,0.35,0.3,10.4,0.65,15.6,1462.5,FORCE_EXIT_1459,NIFTY24011821600CE.csv,NIFTY24011821300PE.csv,2024-01-18 14:59:00,,,4792.5
January,18-01-2024,12:00:00,14:59:00,150,21650,21350,4.9,3.9,0.2,0.35,8.8,0.55,13.2,1237.5,FORCE_EXIT_1459,NIFTY24011821650CE.csv,NIFTY24011821350PE.csv,2024-01-18 14:59:00,,,6030.0
January,18-01-2024,12:15:00,14:59:00,150,21650,21350,5.25,2.9,0.2,0.35,8.15,0.55,12.225,1140.0,FORCE_EXIT_1459,NIFTY24011821650CE.csv,NIFTY24011821350PE.csv,2024-01-18 14:59:00,,,7170.0
January,18-01-2024,12:30:00,14:59:00,150,21650,21350,3.85,3.15,0.2,0.35,7.0,0.55,10.5,967.5,FORCE_EXIT_1459,NIFTY24011821650CE.csv,NIFTY24011821350PE.csv,2024-01-18 14:59:00,,,8137.5
January,18-01-2024,12:45:00,14:59:00,150,21600,21300,2.45,3.95,0.35,0.3,6.4,0.65,9.6,862.5,FORCE_EXIT_1459,NIFTY24011821600CE.csv,NIFTY24011821300PE.csv,2024-01-18 14:59:00,,,9000.0
January,18-01-2024,13:00:00,14:59:00,150,21600,21300,1.95,4.5,0.35,0.3,6.45,0.65,9.675,870.0,FORCE_EXIT_1459,NIFTY24011821600CE.csv,NIFTY24011821300PE.csv,2024-01-18 14:59:00,,,9870.0
January,18-01-2024,13:15:00,14:59:00,150,21600,21300,1.8,3.45,0.35,0.3,5.25,0.65,7.875,690.0,FORCE_EXIT_1459,NIFTY24011821600CE.csv,NIFTY24011821300PE.csv,2024-01-18 14:59:00,,,10560.0
January,18-01-2024,13:30:00,14:59:00,150,21600,21300,1.5,3.05,0.35,0.3,4.55,0.65,6.825,585.0,FORCE_EXIT_1459,NIFTY24011821600CE.csv,NIFTY24011821300PE.csv,2024-01-18 14:59:00,,,11145.0
January,18-01-2024,13:45:00,14:59:00,150,21600,21300,1.05,3.65,0.35,0.3,4.7,0.65,7.05,607.5,FORCE_EXIT_1459,NIFTY24011821600CE.csv,NIFTY24011821300PE.csv,2024-01-18 14:59:00,,,11752.5
January,18-01-2024,14:00:00,14:59:00,150,21600,21300,1.15,2.55,0.35,0.3,3.7,0.65,5.55,457.5,FORCE_EXIT_1459,NIFTY24011821600CE.csv,NIFTY24011821300PE.csv,2024-01-18 14:59:00,,,12210.0
January,18-01-2024,14:15:00,14:59:00,150,21600,21300,1.05,1.65,0.35,0.3,2.7,0.65,4.05,307.5,FORCE_EXIT_1459,NIFTY24011821600CE.csv,NIFTY24011821300PE.csv,2024-01-18 14:59:00,,,12517.5
January,18-01-2024,14:30:00,14:59:00,150,21550,21250,0.85,1.75,0.4,0.25,2.6,0.65,3.9,292.5,FORCE_EXIT_1459,NIFTY24011821550CE.csv,NIFTY24011821250PE.csv,2024-01-18 14:59:00,,,12810.0
January,18-01-2024,14:45:00,14:59:00,150,21600,21300,0.65,0.5,0.35,0.3,1.15,0.65,1.725,75.0,FORCE_EXIT_1459,NIFTY24011821600CE.csv,NIFTY24011821300PE.csv,2024-01-18 14:59:00,,,12885.0
January,19-01-2024,09:45:00,14:59:00,150,21950,21350,48.7,58.1,46.7,44.6,106.8,91.3,160.2,2325.0,FORCE_EXIT_1459,NIFTY24012521950CE.csv,NIFTY24012521350PE.csv,2024-01-19 14:59:00,,,2325.0
January,19-01-2024,10:00:00,14:59:00,150,21950,21350,50.45,49.5,46.7,44.6,99.95,91.3,149.925,1297.5,FORCE_EXIT_1459,NIFTY24012521950CE.csv,NIFTY24012521350PE.csv,2024-01-19 14:59:00,,,3622.5
January,19-01-2024,10:15:00,14:59:00,150,21950,21350,49.55,50.6,46.7,44.6,100.15,91.3,150.225,1327.5,FORCE_EXIT_1459,NIFTY24012521950CE.csv,NIFTY24012521350PE.csv,2024-01-19 14:59:00,,,4950.0
January,19-01-2024,10:30:00,14:59:00,150,21950,21350,55.35,42.4,46.7,44.6,97.75,91.3,146.625,967.5,FORCE_EXIT_1459,NIFTY24012521950CE.csv,NIFTY24012521350PE.csv,2024-01-19 14:59:00,,,5917.5
January,19-01-2024,10:45:00,14:59:00,150,21950,21350,50.25,45.8,46.7,44.6,96.05,91.3,144.075,712.5,FORCE_EXIT_1459,NIFTY24012521950CE.csv,NIFTY24012521350PE.csv,2024-01-19 14:59:00,,,6630.0
January,19-01-2024,11:00:00,14:59:00,150,21900,21300,56.5,45.7,58.85,37.4,102.2,96.25,153.3,892.5,FORCE_EXIT_1459,NIFTY24012521900CE.csv,NIFTY24012521300PE.csv,2024-01-19 14:59:00,,,7522.5
January,19-01-2024,11:15:00,14:59:00,150,21900,21300,47.6,62.3,58.85,37.4,109.9,96.25,164.85,2047.5,FORCE_EXIT_1459,NIFTY24012521900CE.csv,NIFTY24012521300PE.csv,2024-01-19 14:59:00,,,9570.0
January,19-01-2024,11:30:00,14:59:00,150,21900,21300,49.9,53.2,58.85,37.4,103.1,96.25,154.65,1027.5,FORCE_EXIT_1459,NIFTY24012521900CE.csv,NIFTY24012521300PE.csv,2024-01-19 14:59:00,,,10597.5
January,19-01-2024,11:45:00,14:59:00,150,21900,21300,48.35,56.7,58.85,37.4,105.05,96.25,157.575,1320.0,FORCE_EXIT_1459,NIFTY24012521900CE.csv,NIFTY24012521300PE.csv,2024-01-19 14:59:00,,,11917.5
January,19-01-2024,12:00:00,14:59:00,150,21900,21300,51.2,52.15,58.85,37.4,103.35,96.25,155.025,1065.0,FORCE_EXIT_1459,NIFTY24012521900CE.csv,NIFTY24012521300PE.csv,2024-01-19 14:59:00,,,12982.5
January,19-01-2024,12:15:00,14:59:00,150,21900,21300,48.9,54.35,58.85,37.4,103.25,96.25,154.875,1050.0,FORCE_EXIT_1459,NIFTY24012521900CE.csv,NIFTY24012521300PE.csv,2024-01-19 14:59:00,,,14032.5
January,19-01-2024,12:30:00,14:59:00,150,21900,21300,49.2,53.1,58.85,37.4,102.3,96.25,153.45,907.5,FORCE_EXIT_1459,NIFTY24012521900CE.csv,NIFTY24012521300PE.csv,2024-01-19 14:59:00,,,14940.0
January,19-01-2024,12:45:00,14:59:00,150,21900,21300,52.6,47.3,58.85,37.4,99.9,96.25,149.85,547.5,FORCE_EXIT_1459,NIFTY24012521900CE.csv,NIFTY24012521300PE.csv,2024-01-19 14:59:00,,,15487.5
January,19-01-2024,13:00:00,14:59:00,150,21900,21300,52.35,45.0,58.85,37.4,97.35,96.25,146.025,165.0,FORCE_EXIT_1459,NIFTY24012521900CE.csv,NIFTY24012521300PE.csv,2024-01-19 14:59:00,,,15652.5
January,19-01-2024,13:15:00,14:59:00,150,21950,21350,46.55,44.95,46.7,44.6,91.5,91.3,137.25,30.0,FORCE_EXIT_1459,NIFTY24012521950CE.csv,NIFTY24012521350PE.csv,2024-01-19 14:59:00,,,15682.5
January,19-01-2024,13:30:00,14:59:00,150,21900,21300,52.25,43.4,58.85,37.4,95.65,96.25,143.475,-90.0,FORCE_EXIT_1459,NIFTY24012521900CE.csv,NIFTY24012521300PE.csv,2024-01-19 14:59:00,,,15592.5
January,19-01-2024,13:45:00,14:59:00,150,21900,21300,55.6,38.25,58.85,37.4,93.85,96.25,140.775,-360.0,FORCE_EXIT_1459,NIFTY24012521900CE.csv,NIFTY24012521300PE.csv,2024-01-19 14:59:00,,,15232.5
January,19-01-2024,14:00:00,14:59:00,150,21900,21300,53.2,41.35,58.85,37.4,94.55,96.25,141.825,-255.0,FORCE_EXIT_1459,NIFTY24012521900CE.csv,NIFTY24012521300PE.csv,2024-01-19 14:59:00,,,14977.5
January,19-01-2024,14:15:00,14:59:00,150,21900,21300,50.55,46.9,58.85,37.4,97.45,96.25,146.175,180.0,FORCE_EXIT_1459,NIFTY24012521900CE.csv,NIFTY24012521300PE.csv,2024-01-19 14:59:00,,,15157.5
January,19-01-2024,14:30:00,14:59:00,150,21900,21300,56.05,37.1,58.85,37.4,93.15,96.25,139.725,-465.0,FORCE_EXIT_1459,NIFTY24012521900CE.csv,NIFTY24012521300PE.csv,2024-01-19 14:59:00,,,14692.5
January,19-01-2024,14:45:00,14:59:00,150,21950,21350,48.25,39.6,46.7,44.6,87.85,91.3,131.775,-517.5,FORCE_EXIT_1459,NIFTY24012521950CE.csv,NIFTY24012521350PE.csv,2024-01-19 14:59:00,,,14175.0
January,23-01-2024,09:45:00,10:27:00,150,22000,21500,25.2,26.6,13.05,66.65,51.8,79.7,77.7,-4185.0,PAIR_STOPLOSS_HIT,NIFTY24012522000CE.csv,NIFTY24012521500PE.csv,2024-01-23 10:27:00,,,-4185.0
January,23-01-2024,10:15:00,11:32:00,150,21900,21400,34.45,25.45,15.7,74.75,59.9,90.45,89.85,-4582.5,PAIR_STOPLOSS_HIT,NIFTY24012521900CE.csv,NIFTY24012521400PE.csv,2024-01-23 11:32:00,,,-8767.5
January,23-01-2024,10:00:00,11:39:00,150,21900,21400,35.95,26.85,15.85,78.85,62.8,94.7,94.2,-4785.0,PAIR_STOPLOSS_HIT,NIFTY24012521900CE.csv,NIFTY24012521400PE.csv,2024-01-23 11:39:00,,,-13552.5
January,23-01-2024,10:30:00,11:45:00,150,21850,21350,33.75,32.85,18.9,82.2,66.6,101.1,99.9,-5175.0,PAIR_STOPLOSS_HIT,NIFTY24012521850CE.csv,NIFTY24012521350PE.csv,2024-01-23 11:45:00,,,-18727.5
January,23-01-2024,11:00:00,12:03:00,150,21800,21300,33.45,35.3,20.35,84.25,68.75,104.6,103.125,-5377.5,PAIR_STOPLOSS_HIT,NIFTY24012521800CE.csv,NIFTY24012521300PE.csv,2024-01-23 12:03:00,,,-24105.0
January,23-01-2024,11:15:00,12:03:00,150,21800,21300,31.8,35.9,20.35,84.25,67.7,104.6,101.55,-5535.0,PAIR_STOPLOSS_HIT,NIFTY24012521800CE.csv,NIFTY24012521300PE.csv,2024-01-23 12:03:00,,,-29640.0
January,23-01-2024,11:30:00,12:05:00,150,21800,21300,31.25,40.9,20.55,89.45,72.15,110.0,108.225,-5677.5,PAIR_STOPLOSS_HIT,NIFTY24012521800CE.csv,NIFTY24012521300PE.csv,2024-01-23 12:05:00,,,-35317.5
January,23-01-2024,10:45:00,12:06:00,150,21800,21300,34.45,41.65,20.2,97.85,76.1,118.05,114.15,-6292.5,PAIR_STOPLOSS_HIT,NIFTY24012521800CE.csv,NIFTY24012521300PE.csv,2024-01-23 12:06:00,,,-41610.0
January,23-01-2024,11:45:00,14:21:00,150,21700,21200,41.8,45.25,16.7,89.65,87.05,106.35,130.575,-2324.87,MAX_LOSS_EXIT_STRICT,NIFTY24012521700CE.csv,NIFTY24012521200PE.csv,2024-01-23 14:21:00,-2895.0,,-43934.87
January,23-01-2024,12:00:00,14:21:00,150,21700,21200,36.15,49.55,16.7,89.65,85.7,106.35,128.55,-2487.49,MAX_LOSS_EXIT_STRICT,NIFTY24012521700CE.csv,NIFTY24012521200PE.csv,2024-01-23 14:21:00,-3097.5,,-46422.36
January,23-01-2024,12:15:00,14:21:00,150,21650,21150,45.2,45.75,20.2,71.4,90.95,91.6,136.425,-78.3,MAX_LOSS_EXIT_STRICT,NIFTY24012521650CE.csv,NIFTY24012521150PE.csv,2024-01-23 14:21:00,-97.5,,-46500.66
January,23-01-2024,12:30:00,14:21:00,150,21650,21150,42.25,42.9,20.2,71.4,85.15,91.6,127.725,-776.96,MAX_LOSS_EXIT_STRICT,NIFTY24012521650CE.csv,NIFTY24012521150PE.csv,2024-01-23 14:21:00,-967.5,,-47277.62
January,23-01-2024,12:45:00,14:21:00,150,21650,21150,39.85,45.95,20.2,71.4,85.8,91.6,128.7,-698.66,MAX_LOSS_EXIT_STRICT,NIFTY24012521650CE.csv,NIFTY24012521150PE.csv,2024-01-23 14:21:00,-870.0,,-47976.280000000006
January,23-01-2024,13:00:00,14:21:00,150,21600,21100,42.6,41.55,25.1,56.2,84.15,81.3,126.225,343.31,MAX_LOSS_EXIT_STRICT,NIFTY24012521600CE.csv,NIFTY24012521100PE.csv,2024-01-23 14:21:00,427.5,,-47632.97000000001
January,23-01-2024,13:15:00,14:21:00,150,21600,21100,38.2,39.95,25.1,56.2,78.15,81.3,117.225,-379.45,MAX_LOSS_EXIT_STRICT,NIFTY24012521600CE.csv,NIFTY24012521100PE.csv,2024-01-23 14:21:00,-472.5,,-48012.420000000006
January,23-01-2024,13:30:00,14:21:00,150,21600,21100,40.6,37.45,25.1,56.2,78.05,81.3,117.075,-391.49,MAX_LOSS_EXIT_STRICT,NIFTY24012521600CE.csv,NIFTY24012521100PE.csv,2024-01-23 14:21:00,-487.5,,-48403.91
January,23-01-2024,13:45:00,14:21:00,150,21600,21100,36.85,39.7,25.1,56.2,76.55,81.3,114.825,-572.18,MAX_LOSS_EXIT_STRICT,NIFTY24012521600CE.csv,NIFTY24012521100PE.csv,2024-01-23 14:21:00,-712.5,,-48976.090000000004
January,23-01-2024,14:00:00,14:21:00,150,21550,21050,37.2,33.7,31.55,43.95,70.9,75.5,106.35,-554.11,MAX_LOSS_EXIT_STRICT,NIFTY24012521550CE.csv,NIFTY24012521050PE.csv,2024-01-23 14:21:00,-690.0,,-49530.200000000004
January,23-01-2024,14:15:00,14:21:00,150,21550,21050,36.55,35.05,31.55,43.95,71.6,75.5,107.4,-469.79,MAX_LOSS_EXIT_STRICT,NIFTY24012521550CE.csv,NIFTY24012521050PE.csv,2024-01-23 14:21:00,-585.0,,-49999.990000000005
January,24-01-2024,11:15:00,11:32:00,150,21600,21200,29.1,37.15,9.0,91.45,66.25,100.45,99.375,-5130.0,PAIR_STOPLOSS_HIT,NIFTY24012521600CE.csv,NIFTY24012521200PE.csv,2024-01-24 11:32:00,,,-5130.0
January,24-01-2024,11:00:00,12:27:00,150,21600,21200,32.2,38.3,9.9,96.1,70.5,106.0,105.75,-5325.0,PAIR_STOPLOSS_HIT,NIFTY24012521600CE.csv,NIFTY24012521200PE.csv,2024-01-24 12:27:00,,,-10455.0
January,24-01-2024,12:45:00,14:44:00,150,21450,21050,28.8,42.65,101.2,7.3,71.45,108.5,107.175,-5557.5,PAIR_STOPLOSS_HIT,NIFTY24012521450CE.csv,NIFTY24012521050PE.csv,2024-01-24 14:44:00,,,-16012.5
January,24-01-2024,09:45:00,14:59:00,150,21500,21100,43.3,41.65,70.95,9.8,84.95,80.75,127.425,630.0,FORCE_EXIT_1459,NIFTY24012521500CE.csv,NIFTY24012521100PE.csv,2024-01-24 14:59:00,,,-15382.5
January,24-01-2024,10:00:00,14:59:00,150,21600,21200,49.25,40.45,33.55,15.9,89.7,49.45,134.55,6037.5,FORCE_EXIT_1459,NIFTY24012521600CE.csv,NIFTY24012521200PE.csv,2024-01-24 14:59:00,,,-9345.0
January,24-01-2024,10:15:00,14:59:00,150,21550,21150,50.95,36.85,50.65,12.25,87.8,62.9,131.7,3735.0,FORCE_EXIT_1459,NIFTY24012521550CE.csv,NIFTY24012521150PE.csv,2024-01-24 14:59:00,,,-5610.0
January,24-01-2024,10:30:00,14:59:00,150,21600,21200,39.4,37.35,33.55,15.9,76.75,49.45,115.125,4095.0,FORCE_EXIT_1459,NIFTY24012521600CE.csv,NIFTY24012521200PE.csv,2024-01-24 14:59:00,,,-1515.0
January,24-01-2024,10:45:00,14:59:00,150,21550,21150,37.75,37.65,50.65,12.25,75.4,62.9,113.1,1875.0,FORCE_EXIT_1459,NIFTY24012521550CE.csv,NIFTY24012521150PE.csv,2024-01-24 14:59:00,,,360.0
January,24-01-2024,11:30:00,14:59:00,150,21450,21050,39.1,38.75,98.35,7.8,77.85,106.15,116.775,-4245.0,FORCE_EXIT_1459,NIFTY24012521450CE.csv,NIFTY24012521050PE.csv,2024-01-24 14:59:00,,,-3885.0
January,24-01-2024,11:45:00,14:59:00,150,21500,21100,33.15,38.8,70.95,9.8,71.95,80.75,107.925,-1320.0,FORCE_EXIT_1459,NIFTY24012521500CE.csv,NIFTY24012521100PE.csv,2024-01-24 14:59:00,,,-5205.0
January,24-01-2024,12:00:00,14:59:00,150,21500,21100,28.8,43.8,70.95,9.8,72.6,80.75,108.9,-1222.5,FORCE_EXIT_1459,NIFTY24012521500CE.csv,NIFTY24012521100PE.csv,2024-01-24 14:59:00,,,-6427.5
January,24-01-2024,12:15:00,14:59:00,150,21450,21050,36.25,40.7,98.35,7.8,76.95,106.15,115.425,-4380.0,FORCE_EXIT_1459,NIFTY24012521450CE.csv,NIFTY24012521050PE.csv,2024-01-24 14:59:00,,,-10807.5
January,24-01-2024,12:30:00,14:59:00,150,21450,21050,33.9,39.5,98.35,7.8,73.4,106.15,110.1,-4912.5,FORCE_EXIT_1459,NIFTY24012521450CE.csv,NIFTY24012521050PE.csv,2024-01-24 14:59:00,,,-15720.0
January,24-01-2024,13:00:00,14:59:00,150,21500,21100,37.35,30.6,70.95,9.8,67.95,80.75,101.925,-1920.0,FORCE_EXIT_1459,NIFTY24012521500CE.csv,NIFTY24012521100PE.csv,2024-01-24 14:59:00,,,-17640.0
January,24-01-2024,13:15:00,14:59:00,150,21500,21100,31.05,35.5,70.95,9.8,66.55,80.75,99.825,-2130.0,FORCE_EXIT_1459,NIFTY24012521500CE.csv,NIFTY24012521100PE.csv,2024-01-24 14:59:00,,,-19770.0
January,24-01-2024,13:30:00,14:59:00,150,21500,21100,34.4,30.7,70.95,9.8,65.1,80.75,97.65,-2347.5,FORCE_EXIT_1459,NIFTY24012521500CE.csv,NIFTY24012521100PE.csv,2024-01-24 14:59:00,,,-22117.5
January,24-01-2024,13:45:00,14:59:00,150,21500,21100,31.2,30.7,70.95,9.8,61.9,80.75,92.85,-2827.5,FORCE_EXIT_1459,NIFTY24012521500CE.csv,NIFTY24012521100PE.csv,2024-01-24 14:59:00,,,-24945.0
January,24-01-2024,14:00:00,14:59:00,150,21500,21100,35.15,27.7,70.95,9.8,62.85,80.75,94.275,-2685.0,FORCE_EXIT_1459,NIFTY24012521500CE.csv,NIFTY24012521100PE.csv,2024-01-24 14:59:00,,,-27630.0
January,24-01-2024,14:15:00,14:59:00,150,21550,21150,28.2,28.75,50.65,12.25,56.95,62.9,85.425,-892.5,FORCE_EXIT_1459,NIFTY24012521550CE.csv,NIFTY24012521150PE.csv,2024-01-24 14:59:00,,,-28522.5
January,24-01-2024,14:30:00,14:59:00,150,21600,21200,23.2,23.75,33.55,15.9,46.95,49.45,70.425,-375.0,FORCE_EXIT_1459,NIFTY24012521600CE.csv,NIFTY24012521200PE.csv,2024-01-24 14:59:00,,,-28897.5
January,24-01-2024,14:45:00,14:59:00,150,21650,21250,23.15,24.05,21.5,20.5,47.2,42.0,70.8,780.0,FORCE_EXIT_1459,NIFTY24012521650CE.csv,NIFTY24012521250PE.csv,2024-01-24 14:59:00,,,-28117.5
January,25-01-2024,10:15:00,10:54:00,150,21500,21200,13.15,17.0,7.15,41.0,30.15,48.15,45.225,-2700.0,PAIR_STOPLOSS_HIT,NIFTY24012521500CE.csv,NIFTY24012521200PE.csv,2024-01-25 10:54:00,,,-2700.0
January,25-01-2024,11:15:00,11:40:00,150,21400,21100,16.4,13.45,44.15,3.75,29.85,47.9,44.775,-2707.5,PAIR_STOPLOSS_HIT,NIFTY24012521400CE.csv,NIFTY24012521100PE.csv,2024-01-25 11:40:00,,,-5407.5
January,25-01-2024,11:00:00,11:42:00,150,21400,21100,15.5,18.4,47.3,3.6,33.9,50.9,50.85,-2550.0,PAIR_STOPLOSS_HIT,NIFTY24012521400CE.csv,NIFTY24012521100PE.csv,2024-01-25 11:42:00,,,-7957.5
January,25-01-2024,09:45:00,14:59:00,150,21500,21200,18.0,18.8,0.3,0.6,36.8,0.9,55.2,5385.0,FORCE_EXIT_1459,NIFTY24012521500CE.csv,NIFTY24012521200PE.csv,2024-01-25 14:59:00,,,-2572.5
January,25-01-2024,10:00:00,14:59:00,150,21500,21200,18.05,16.8,0.3,0.6,34.85,0.9,52.275,5092.5,FORCE_EXIT_1459,NIFTY24012521500CE.csv,NIFTY24012521200PE.csv,2024-01-25 14:59:00,,,2520.0
January,25-01-2024,10:30:00,14:59:00,150,21450,21150,14.2,17.7,0.35,0.35,31.9,0.7,47.85,4680.0,FORCE_EXIT_1459,NIFTY24012521450CE.csv,NIFTY24012521150PE.csv,2024-01-25 14:59:00,,,7200.0
January,25-01-2024,10:45:00,14:59:00,150,21450,21150,14.7,15.85,0.35,0.35,30.55,0.7,45.825,4477.5,FORCE_EXIT_1459,NIFTY24012521450CE.csv,NIFTY24012521150PE.csv,2024-01-25 14:59:00,,,11677.5
January,25-01-2024,11:30:00,14:59:00,150,21450,21150,11.7,12.45,0.35,0.35,24.15,0.7,36.225,3517.5,FORCE_EXIT_1459,NIFTY24012521450CE.csv,NIFTY24012521150PE.csv,2024-01-25 14:59:00,,,15195.0
January,25-01-2024,11:45:00,14:59:00,150,21500,21200,12.2,10.05,0.3,0.6,22.25,0.9,33.375,3202.5,FORCE_EXIT_1459,NIFTY24012521500CE.csv,NIFTY24012521200PE.csv,2024-01-25 14:59:00,,,18397.5
January,25-01-2024,12:00:00,14:59:00,150,21450,21150,8.5,11.5,0.35,0.35,20.0,0.7,30.0,2895.0,FORCE_EXIT_1459,NIFTY24012521450CE.csv,NIFTY24012521150PE.csv,2024-01-25 14:59:00,,,21292.5
January,25-01-2024,12:15:00,14:59:00,150,21450,21150,5.45,12.0,0.35,0.35,17.45,0.7,26.175,2512.5,FORCE_EXIT_1459,NIFTY24012521450CE.csv,NIFTY24012521150PE.csv,2024-01-25 14:59:00,,,23805.0
January,25-01-2024,12:30:00,14:59:00,150,21450,21150,4.9,5.4,0.35,0.35,10.3,0.7,15.45,1440.0,FORCE_EXIT_1459,NIFTY24012521450CE.csv,NIFTY24012521150PE.csv,2024-01-25 14:59:00,,,25245.0
January,25-01-2024,12:45:00,14:59:00,150,21450,21150,3.75,4.15,0.35,0.35,7.9,0.7,11.85,1080.0,FORCE_EXIT_1459,NIFTY24012521450CE.csv,NIFTY24012521150PE.csv,2024-01-25 14:59:00,,,26325.0
January,25-01-2024,13:00:00,14:59:00,150,21400,21100,4.3,2.6,0.5,0.35,6.9,0.85,10.35,907.5,FORCE_EXIT_1459,NIFTY24012521400CE.csv,NIFTY24012521100PE.csv,2024-01-25 14:59:00,,,27232.5
January,25-01-2024,13:15:00,14:59:00,150,21450,21150,2.85,3.15,0.35,0.35,6.0,0.7,9.0,795.0,FORCE_EXIT_1459,NIFTY24012521450CE.csv,NIFTY24012521150PE.csv,2024-01-25 14:59:00,,,28027.5
January,25-01-2024,13:30:00,14:59:00,150,21400,21100,3.6,2.25,0.5,0.35,5.85,0.85,8.775,750.0,FORCE_EXIT_1459,NIFTY24012521400CE.csv,NIFTY24012521100PE.csv,2024-01-25 14:59:00,,,28777.5
January,25-01-2024,13:45:00,14:59:00,150,21450,21150,2.4,2.25,0.35,0.35,4.65,0.7,6.975,592.5,FORCE_EXIT_1459,NIFTY24012521450CE.csv,NIFTY24012521150PE.csv,2024-01-25 14:59:00,,,29370.0
January,25-01-2024,14:00:00,14:59:00,150,21450,21150,2.5,1.5,0.35,0.35,4.0,0.7,6.0,495.0,FORCE_EXIT_1459,NIFTY24012521450CE.csv,NIFTY24012521150PE.csv,2024-01-25 14:59:00,,,29865.0
January,25-01-2024,14:15:00,14:59:00,150,21450,21150,1.15,1.65,0.35,0.35,2.8,0.7,4.2,315.0,FORCE_EXIT_1459,NIFTY24012521450CE.csv,NIFTY24012521150PE.csv,2024-01-25 14:59:00,,,30180.0
January,25-01-2024,14:30:00,14:59:00,150,21450,21150,0.85,0.7,0.35,0.35,1.55,0.7,2.325,127.5,FORCE_EXIT_1459,NIFTY24012521450CE.csv,NIFTY24012521150PE.csv,2024-01-25 14:59:00,,,30307.5
January,25-01-2024,14:45:00,14:59:00,150,21400,21100,0.7,0.55,0.5,0.35,1.25,0.85,1.875,60.0,FORCE_EXIT_1459,NIFTY24012521400CE.csv,NIFTY24012521100PE.csv,2024-01-25 14:59:00,,,30367.5
January,29-01-2024,09:45:00,14:59:00,150,21800,21300,111.2,79.35,149.0,49.4,190.55,198.4,285.825,-1177.5,FORCE_EXIT_1459,NIFTY24020121800CE.csv,NIFTY24020121300PE.csv,2024-01-29 14:59:00,,,-1177.5
January,29-01-2024,10:00:00,14:59:00,150,21850,21350,112.05,71.15,126.45,57.35,183.2,183.8,274.8,-90.0,FORCE_EXIT_1459,NIFTY24020121850CE.csv,NIFTY24020121350PE.csv,2024-01-29 14:59:00,,,-1267.5
January,29-01-2024,10:15:00,14:59:00,150,21800,21300,126.8,66.0,149.0,49.4,192.8,198.4,289.2,-840.0,FORCE_EXIT_1459,NIFTY24020121800CE.csv,NIFTY24020121300PE.csv,2024-01-29 14:59:00,,,-2107.5
January,29-01-2024,10:30:00,14:59:00,150,21850,21350,104.0,79.6,126.45,57.35,183.6,183.8,275.4,-30.0,FORCE_EXIT_1459,NIFTY24020121850CE.csv,NIFTY24020121350PE.csv,2024-01-29 14:59:00,,,-2137.5
January,29-01-2024,10:45:00,14:59:00,150,21850,21350,104.25,78.4,126.45,57.35,182.65,183.8,273.975,-172.5,FORCE_EXIT_1459,NIFTY24020121850CE.csv,NIFTY24020121350PE.csv,2024-01-29 14:59:00,,,-2310.0
January,29-01-2024,11:00:00,14:59:00,150,21900,21400,91.85,83.45,105.7,67.55,175.3,173.25,262.95,307.5,FORCE_EXIT_1459,NIFTY24020121900CE.csv,NIFTY24020121400PE.csv,2024-01-29 14:59:00,,,-2002.5
January,29-01-2024,11:15:00,14:59:00,150,21900,21400,91.35,85.45,105.7,67.55,176.8,173.25,265.2,532.5,FORCE_EXIT_1459,NIFTY24020121900CE.csv,NIFTY24020121400PE.csv,2024-01-29 14:59:00,,,-1470.0
January,29-01-2024,11:30:00,14:59:00,150,21900,21400,89.7,75.1,105.7,67.55,164.8,173.25,247.2,-1267.5,FORCE_EXIT_1459,NIFTY24020121900CE.csv,NIFTY24020121400PE.csv,2024-01-29 14:59:00,,,-2737.5
January,29-01-2024,11:45:00,14:59:00,150,21900,21400,88.3,79.1,105.7,67.55,167.4,173.25,251.1,-877.5,FORCE_EXIT_1459,NIFTY24020121900CE.csv,NIFTY24020121400PE.csv,2024-01-29 14:59:00,,,-3615.0
January,29-01-2024,12:00:00,14:59:00,150,21900,21400,93.75,78.1,105.7,67.55,171.85,173.25,257.775,-210.0,FORCE_EXIT_1459,NIFTY24020121900CE.csv,NIFTY24020121400PE.csv,2024-01-29 14:59:00,,,-3825.0
January,29-01-2024,12:15:00,14:59:00,150,21900,21400,92.85,77.65,105.7,67.55,170.5,173.25,255.75,-412.5,FORCE_EXIT_1459,NIFTY24020121900CE.csv,NIFTY24020121400PE.csv,2024-01-29 14:59:00,,,-4237.5
January,29-01-2024,12:30:00,14:59:00,150,21900,21400,91.85,77.9,105.7,67.55,169.75,173.25,254.625,-525.0,FORCE_EXIT_1459,NIFTY24020121900CE.csv,NIFTY24020121400PE.csv,2024-01-29 14:59:00,,,-4762.5
January,29-01-2024,12:45:00,14:59:00,150,21950,21450,85.75,82.0,87.95,79.05,167.75,167.0,251.625,112.5,FORCE_EXIT_1459,NIFTY24020121950CE.csv,NIFTY24020121450PE.csv,2024-01-29 14:59:00,,,-4650.0
January,29-01-2024,13:00:00,14:59:00,150,21950,21450,101.75,81.4,87.95,79.05,183.15,167.0,274.725,2422.5,FORCE_EXIT_1459,NIFTY24020121950CE.csv,NIFTY24020121450PE.csv,2024-01-29 14:59:00,,,-2227.5
January,29-01-2024,13:15:00,14:59:00,150,21950,21450,96.25,84.35,87.95,79.05,180.6,167.0,270.9,2040.0,FORCE_EXIT_1459,NIFTY24020121950CE.csv,NIFTY24020121450PE.csv,2024-01-29 14:59:00,,,-187.5
January,29-01-2024,13:30:00,14:59:00,150,21950,21450,90.0,87.4,87.95,79.05,177.4,167.0,266.1,1560.0,FORCE_EXIT_1459,NIFTY24020121950CE.csv,NIFTY24020121450PE.csv,2024-01-29 14:59:00,,,1372.5
January,29-01-2024,13:45:00,14:59:00,150,21950,21450,92.15,83.55,87.95,79.05,175.7,167.0,263.55,1305.0,FORCE_EXIT_1459,NIFTY24020121950CE.csv,NIFTY24020121450PE.csv,2024-01-29 14:59:00,,,2677.5
January,29-01-2024,14:00:00,14:59:00,150,22000,21500,84.6,88.5,71.75,91.8,173.1,163.55,259.65,1432.5,FORCE_EXIT_1459,NIFTY24020122000CE.csv,NIFTY24020121500PE.csv,2024-01-29 14:59:00,,,4110.0
January,29-01-2024,14:15:00,14:59:00,150,21950,21450,95.95,79.6,87.95,79.05,175.55,167.0,263.325,1282.5,FORCE_EXIT_1459,NIFTY24020121950CE.csv,NIFTY24020121450PE.csv,2024-01-29 14:59:00,,,5392.5
January,29-01-2024,14:30:00,14:59:00,150,21950,21450,94.7,79.45,87.95,79.05,174.15,167.0,261.225,1072.5,FORCE_EXIT_1459,NIFTY24020121950CE.csv,NIFTY24020121450PE.csv,2024-01-29 14:59:00,,,6465.0
January,29-01-2024,14:45:00,14:59:00,150,22000,21500,82.2,84.8,71.75,91.8,167.0,163.55,250.5,517.5,FORCE_EXIT_1459,NIFTY24020122000CE.csv,NIFTY24020121500PE.csv,2024-01-29 14:59:00,,,6982.5
January,30-01-2024,09:45:00,14:59:00,150,22000,21500,93.65,70.45,23.5,127.15,164.1,150.65,246.15,2017.5,FORCE_EXIT_1459,NIFTY24020122000CE.csv,NIFTY24020121500PE.csv,2024-01-30 14:59:00,,,2017.5
January,30-01-2024,10:00:00,14:59:00,150,22000,21500,83.0,73.0,23.5,127.15,156.0,150.65,234.0,802.5,FORCE_EXIT_1459,NIFTY24020122000CE.csv,NIFTY24020121500PE.csv,2024-01-30 14:59:00,,,2820.0
January,30-01-2024,10:15:00,14:59:00,150,22000,21500,85.0,69.05,23.5,127.15,154.05,150.65,231.075,510.0,FORCE_EXIT_1459,NIFTY24020122000CE.csv,NIFTY24020121500PE.csv,2024-01-30 14:59:00,,,3330.0
January,30-01-2024,10:30:00,14:59:00,150,22000,21500,73.4,75.6,23.5,127.15,149.0,150.65,223.5,-247.5,FORCE_EXIT_1459,NIFTY24020122000CE.csv,NIFTY24020121500PE.csv,2024-01-30 14:59:00,,,3082.5
January,30-01-2024,10:45:00,14:59:00,150,21950,21450,81.8,66.95,30.0,107.45,148.75,137.45,223.125,1695.0,FORCE_EXIT_1459,NIFTY24020121950CE.csv,NIFTY24020121450PE.csv,2024-01-30 14:59:00,,,4777.5
January,30-01-2024,11:00:00,14:59:00,150,21950,21450,79.0,68.2,30.0,107.45,147.2,137.45,220.8,1462.5,FORCE_EXIT_1459,NIFTY24020121950CE.csv,NIFTY24020121450PE.csv,2024-01-30 14:59:00,,,6240.0
January,30-01-2024,11:15:00,14:59:00,150,21950,21450,68.4,73.5,30.0,107.45,141.9,137.45,212.85,667.5,FORCE_EXIT_1459,NIFTY24020121950CE.csv,NIFTY24020121450PE.csv,2024-01-30 14:59:00,,,6907.5
January,30-01-2024,11:30:00,14:59:00,150,21950,21450,71.5,63.6,30.0,107.45,135.1,137.45,202.65,-352.5,FORCE_EXIT_1459,NIFTY24020121950CE.csv,NIFTY24020121450PE.csv,2024-01-30 14:59:00,,,6555.0
January,30-01-2024,11:45:00,14:59:00,150,21950,21450,75.85,60.2,30.0,107.45,136.05,137.45,204.075,-210.0,FORCE_EXIT_1459,NIFTY24020121950CE.csv,NIFTY24020121450PE.csv,2024-01-30 14:59:00,,,6345.0
January,30-01-2024,12:00:00,14:59:00,150,22000,21500,64.65,65.85,23.5,127.15,130.5,150.65,195.75,-3022.5,FORCE_EXIT_1459,NIFTY24020122000CE.csv,NIFTY24020121500PE.csv,2024-01-30 14:59:00,,,3322.5
January,30-01-2024,12:15:00,14:59:00,150,21950,21450,67.9,62.95,30.0,107.45,130.85,137.45,196.275,-990.0,FORCE_EXIT_1459,NIFTY24020121950CE.csv,NIFTY24020121450PE.csv,2024-01-30 14:59:00,,,2332.5
January,30-01-2024,12:30:00,14:59:00,150,21950,21450,69.45,60.25,30.0,107.45,129.7,137.45,194.55,-1162.5,FORCE_EXIT_1459,NIFTY24020121950CE.csv,NIFTY24020121450PE.csv,2024-01-30 14:59:00,,,1170.0
January,30-01-2024,12:45:00,14:59:00,150,21950,21450,62.45,68.5,30.0,107.45,130.95,137.45,196.425,-975.0,FORCE_EXIT_1459,NIFTY24020121950CE.csv,NIFTY24020121450PE.csv,2024-01-30 14:59:00,,,195.0
January,30-01-2024,13:00:00,14:59:00,150,21950,21450,66.4,61.55,30.0,107.45,127.95,137.45,191.925,-1425.0,FORCE_EXIT_1459,NIFTY24020121950CE.csv,NIFTY24020121450PE.csv,2024-01-30 14:59:00,,,-1230.0
January,30-01-2024,13:15:00,14:59:00,150,21900,21400,72.25,60.65,38.5,90.4,132.9,128.9,199.35,600.0,FORCE_EXIT_1459,NIFTY24020121900CE.csv,NIFTY24020121400PE.csv,2024-01-30 14:59:00,,,-630.0
January,30-01-2024,13:30:00,14:59:00,150,21950,21450,61.1,62.95,30.0,107.45,124.05,137.45,186.075,-2010.0,FORCE_EXIT_1459,NIFTY24020121950CE.csv,NIFTY24020121450PE.csv,2024-01-30 14:59:00,,,-2640.0
January,30-01-2024,13:45:00,14:59:00,150,21950,21450,57.4,65.35,30.0,107.45,122.75,137.45,184.125,-2205.0,FORCE_EXIT_1459,NIFTY24020121950CE.csv,NIFTY24020121450PE.csv,2024-01-30 14:59:00,,,-4845.0
January,30-01-2024,14:00:00,14:59:00,150,21900,21400,68.7,56.8,38.5,90.4,125.5,128.9,188.25,-510.0,FORCE_EXIT_1459,NIFTY24020121900CE.csv,NIFTY24020121400PE.csv,2024-01-30 14:59:00,,,-5355.0
January,30-01-2024,14:15:00,14:59:00,150,21900,21400,64.2,60.5,38.5,90.4,124.7,128.9,187.05,-630.0,FORCE_EXIT_1459,NIFTY24020121900CE.csv,NIFTY24020121400PE.csv,2024-01-30 14:59:00,,,-5985.0
January,30-01-2024,14:30:00,14:59:00,150,21850,21350,69.6,66.85,48.9,75.45,136.45,124.35,204.675,1815.0,FORCE_EXIT_1459,NIFTY24020121850CE.csv,NIFTY24020121350PE.csv,2024-01-30 14:59:00,,,-4170.0
January,30-01-2024,14:45:00,14:59:00,150,21800,21300,67.95,64.75,61.6,62.35,132.7,123.95,199.05,1312.5,FORCE_EXIT_1459,NIFTY24020121800CE.csv,NIFTY24020121300PE.csv,2024-01-30 14:59:00,,,-2857.5
January,31-01-2024,09:45:00,14:59:00,150,21800,21400,68.05,64.15,83.1,30.35,132.2,113.45,198.3,2812.5,FORCE_EXIT_1459,NIFTY24020121800CE.csv,NIFTY24020121400PE.csv,2024-01-31 14:59:00,,,2812.5
January,31-01-2024,10:00:00,14:59:00,150,21750,21350,69.8,60.45,102.95,24.25,130.25,127.2,195.375,457.5,FORCE_EXIT_1459,NIFTY24020121750CE.csv,NIFTY24020121350PE.csv,2024-01-31 14:59:00,,,3270.0
January,31-01-2024,10:15:00,14:59:00,150,21800,21400,71.65,49.25,83.1,30.35,120.9,113.45,181.35,1117.5,FORCE_EXIT_1459,NIFTY24020121800CE.csv,NIFTY24020121400PE.csv,2024-01-31 14:59:00,,,4387.5
January,31-01-2024,10:30:00,14:59:00,150,21800,21400,67.0,48.7,83.1,30.35,115.7,113.45,173.55,337.5,FORCE_EXIT_1459,NIFTY24020121800CE.csv,NIFTY24020121400PE.csv,2024-01-31 14:59:00,,,4725.0
January,31-01-2024,10:45:00,14:59:00,150,21800,21400,71.4,40.15,83.1,30.35,111.55,113.45,167.325,-285.0,FORCE_EXIT_1459,NIFTY24020121800CE.csv,NIFTY24020121400PE.csv,2024-01-31 14:59:00,,,4440.0
January,31-01-2024,11:00:00,14:59:00,150,21850,21450,62.0,45.55,66.7,38.15,107.55,104.85,161.325,405.0,FORCE_EXIT_1459,NIFTY24020121850CE.csv,NIFTY24020121450PE.csv,2024-01-31 14:59:00,,,4845.0
January,31-01-2024,11:15:00,14:59:00,150,21850,21450,69.2,42.0,66.7,38.15,111.2,104.85,166.8,952.5,FORCE_EXIT_1459,NIFTY24020121850CE.csv,NIFTY24020121450PE.csv,2024-01-31 14:59:00,,,5797.5
January,31-01-2024,11:30:00,14:59:00,150,21900,21500,62.65,50.0,52.6,47.95,112.65,100.55,168.975,1815.0,FORCE_EXIT_1459,NIFTY24020121900CE.csv,NIFTY24020121500PE.csv,2024-01-31 14:59:00,,,7612.5
January,31-01-2024,11:45:00,14:59:00,150,21900,21500,68.9,48.2,52.6,47.95,117.1,100.55,175.65,2482.5,FORCE_EXIT_1459,NIFTY24020121900CE.csv,NIFTY24020121500PE.csv,2024-01-31 14:59:00,,,10095.0
January,31-01-2024,12:00:00,14:59:00,150,21900,21500,71.5,46.35,52.6,47.95,117.85,100.55,176.775,2595.0,FORCE_EXIT_1459,NIFTY24020121900CE.csv,NIFTY24020121500PE.csv,2024-01-31 14:59:00,,,12690.0
January,31-01-2024,12:15:00,14:59:00,150,21900,21500,67.1,46.05,52.6,47.95,113.15,100.55,169.725,1890.0,FORCE_EXIT_1459,NIFTY24020121900CE.csv,NIFTY24020121500PE.csv,2024-01-31 14:59:00,,,14580.0
January,31-01-2024,12:30:00,14:59:00,150,21850,21450,60.8,43.3,66.7,38.15,104.1,104.85,156.15,-112.5,FORCE_EXIT_1459,NIFTY24020121850CE.csv,NIFTY24020121450PE.csv,2024-01-31 14:59:00,,,14467.5
January,31-01-2024,12:45:00,14:59:00,150,21850,21450,53.5,46.1,66.7,38.15,99.6,104.85,149.4,-787.5,FORCE_EXIT_1459,NIFTY24020121850CE.csv,NIFTY24020121450PE.csv,2024-01-31 14:59:00,,,13680.0
January,31-01-2024,13:00:00,14:59:00,150,21850,21450,59.7,42.0,66.7,38.15,101.7,104.85,152.55,-472.5,FORCE_EXIT_1459,NIFTY24020121850CE.csv,NIFTY24020121450PE.csv,2024-01-31 14:59:00,,,13207.5
January,31-01-2024,13:15:00,14:59:00,150,21900,21500,53.65,44.6,52.6,47.95,98.25,100.55,147.375,-345.0,FORCE_EXIT_1459,NIFTY24020121900CE.csv,NIFTY24020121500PE.csv,2024-01-31 14:59:00,,,12862.5
January,31-01-2024,13:30:00,14:59:00,150,21900,21500,57.65,40.0,52.6,47.95,97.65,100.55,146.475,-435.0,FORCE_EXIT_1459,NIFTY24020121900CE.csv,NIFTY24020121500PE.csv,2024-01-31 14:59:00,,,12427.5
January,31-01-2024,13:45:00,14:59:00,150,21900,21500,48.45,48.85,52.6,47.95,97.3,100.55,145.95,-487.5,FORCE_EXIT_1459,NIFTY24020121900CE.csv,NIFTY24020121500PE.csv,2024-01-31 14:59:00,,,11940.0
January,31-01-2024,14:00:00,14:59:00,150,21900,21500,50.7,44.45,52.6,47.95,95.15,100.55,142.725,-810.0,FORCE_EXIT_1459,NIFTY24020121900CE.csv,NIFTY24020121500PE.csv,2024-01-31 14:59:00,,,11130.0
January,31-01-2024,14:15:00,14:59:00,150,21900,21500,49.1,45.05,52.6,47.95,94.15,100.55,141.225,-960.0,FORCE_EXIT_1459,NIFTY24020121900CE.csv,NIFTY24020121500PE.csv,2024-01-31 14:59:00,,,10170.0
January,31-01-2024,14:30:00,14:59:00,150,21900,21500,47.05,49.15,52.6,47.95,96.2,100.55,144.3,-652.5,FORCE_EXIT_1459,NIFTY24020121900CE.csv,NIFTY24020121500PE.csv,2024-01-31 14:59:00,,,9517.5
January,31-01-2024,14:45:00,14:59:00,150,21900,21500,52.4,44.95,52.6,47.95,97.35,100.55,146.025,-480.0,FORCE_EXIT_1459,NIFTY24020121900CE.csv,NIFTY24020121500PE.csv,2024-01-31 14:59:00,,,9037.5
February,01-02-2024,09:45:00,14:59:00,150,21900,21600,41.65,44.1,0.65,0.7,85.75,1.35,128.625,12660.0,FORCE_EXIT_1459,NIFTY24020121900CE.csv,NIFTY24020121600PE.csv,2024-02-01 14:59:00,,,12660.0
February,01-02-2024,10:00:00,14:59:00,150,21900,21600,40.8,36.3,0.65,0.7,77.1,1.35,115.65,11362.5,FORCE_EXIT_1459,NIFTY24020121900CE.csv,NIFTY24020121600PE.csv,2024-02-01 14:59:00,,,24022.5
February,01-02-2024,10:15:00,14:59:00,150,21900,21600,48.3,32.65,0.65,0.7,80.95,1.35,121.425,11940.0,FORCE_EXIT_1459,NIFTY24020121900CE.csv,NIFTY24020121600PE.csv,2024-02-01 14:59:00,,,35962.5
February,01-02-2024,10:30:00,14:59:00,150,21950,21650,41.65,35.85,0.45,1.1,77.5,1.55,116.25,11392.5,FORCE_EXIT_1459,NIFTY24020121950CE.csv,NIFTY24020121650PE.csv,2024-02-01 14:59:00,,,47355.0
February,01-02-2024,10:45:00,14:59:00,150,21950,21650,42.45,39.1,0.45,1.1,81.55,1.55,122.325,12000.0,FORCE_EXIT_1459,NIFTY24020121950CE.csv,NIFTY24020121650PE.csv,2024-02-01 14:59:00,,,59355.0
February,01-02-2024,11:00:00,14:59:00,150,21950,21650,47.55,39.35,0.45,1.1,86.9,1.55,130.35,12802.5,FORCE_EXIT_1459,NIFTY24020121950CE.csv,NIFTY24020121650PE.csv,2024-02-01 14:59:00,,,72157.5
February,01-02-2024,11:15:00,14:59:00,150,21900,21600,55.8,36.8,0.65,0.7,92.6,1.35,138.9,13687.5,FORCE_EXIT_1459,NIFTY24020121900CE.csv,NIFTY24020121600PE.csv,2024-02-01 14:59:00,,,85845.0
February,01-02-2024,11:30:00,14:59:00,150,21900,21600,46.45,48.45,0.65,0.7,94.9,1.35,142.35,14032.5,FORCE_EXIT_1459,NIFTY24020121900CE.csv,NIFTY24020121600PE.csv,2024-02-01 14:59:00,,,99877.5
February,01-02-2024,11:45:00,14:59:00,150,21900,21600,44.25,39.2,0.65,0.7,83.45,1.35,125.175,12315.0,FORCE_EXIT_1459,NIFTY24020121900CE.csv,NIFTY24020121600PE.csv,2024-02-01 14:59:00,,,112192.5
February,01-02-2024,12:00:00,14:59:00,150,21900,21600,22.7,33.65,0.65,0.7,56.35,1.35,84.525,8250.0,FORCE_EXIT_1459,NIFTY24020121900CE.csv,NIFTY24020121600PE.csv,2024-02-01 14:59:00,,,120442.5
February,01-02-2024,12:15:00,14:59:00,150,21900,21600,15.0,14.35,0.65,0.7,29.35,1.35,44.025,4200.0,FORCE_EXIT_1459,NIFTY24020121900CE.csv,NIFTY24020121600PE.csv,2024-02-01 14:59:00,,,124642.5
February,01-02-2024,12:30:00,14:59:00,150,21850,21550,15.35,10.6,0.9,0.45,25.95,1.35,38.925,3690.0,FORCE_EXIT_1459,NIFTY24020121850CE.csv,NIFTY24020121550PE.csv,2024-02-01 14:59:00,,,128332.5
February,01-02-2024,12:45:00,14:59:00,150,21900,21600,9.8,12.25,0.65,0.7,22.05,1.35,33.075,3105.0,FORCE_EXIT_1459,NIFTY24020121900CE.csv,NIFTY24020121600PE.csv,2024-02-01 14:59:00,,,131437.5
February,01-02-2024,13:00:00,14:59:00,150,21850,21550,9.15,9.15,0.9,0.45,18.3,1.35,27.45,2542.5,FORCE_EXIT_1459,NIFTY24020121850CE.csv,NIFTY24020121550PE.csv,2024-02-01 14:59:00,,,133980.0
February,01-02-2024,13:15:00,14:59:00,150,21900,21600,5.65,8.15,0.65,0.7,13.8,1.35,20.7,1867.5,FORCE_EXIT_1459,NIFTY24020121900CE.csv,NIFTY24020121600PE.csv,2024-02-01 14:59:00,,,135847.5
February,01-02-2024,13:30:00,14:59:00,150,21850,21550,5.0,9.55,0.9,0.45,14.55,1.35,21.825,1980.0,FORCE_EXIT_1459,NIFTY24020121850CE.csv,NIFTY24020121550PE.csv,2024-02-01 14:59:00,,,137827.5
February,01-02-2024,13:45:00,14:59:00,150,21850,21550,3.3,6.95,0.9,0.45,10.25,1.35,15.375,1335.0,FORCE_EXIT_1459,NIFTY24020121850CE.csv,NIFTY24020121550PE.csv,2024-02-01 14:59:00,,,139162.5
February,01-02-2024,14:00:00,14:59:00,150,21850,21550,3.3,3.85,0.9,0.45,7.15,1.35,10.725,870.0,FORCE_EXIT_1459,NIFTY24020121850CE.csv,NIFTY24020121550PE.csv,2024-02-01 14:59:00,,,140032.5
February,01-02-2024,14:15:00,14:59:00,150,21850,21550,2.4,2.25,0.9,0.45,4.65,1.35,6.975,495.0,FORCE_EXIT_1459,NIFTY24020121850CE.csv,NIFTY24020121550PE.csv,2024-02-01 14:59:00,,,140527.5
February,01-02-2024,14:30:00,14:59:00,150,21850,21550,1.9,1.35,0.9,0.45,3.25,1.35,4.875,285.0,FORCE_EXIT_1459,NIFTY24020121850CE.csv,NIFTY24020121550PE.csv,2024-02-01 14:59:00,,,140812.5
February,01-02-2024,14:45:00,14:59:00,150,21850,21550,0.7,1.55,0.9,0.45,2.25,1.35,3.375,135.0,FORCE_EXIT_1459,NIFTY24020121850CE.csv,NIFTY24020121550PE.csv,2024-02-01 14:59:00,,,140947.5
February,02-02-2024,10:45:00,11:37:00,150,22200,21600,64.6,40.95,127.0,32.45,105.55,159.45,158.325,-8085.0,PAIR_STOPLOSS_HIT,NIFTY24020822200CE.csv,NIFTY24020821600PE.csv,2024-02-02 11:37:00,,,-8085.0
February,02-02-2024,09:45:00,11:39:00,150,22200,21600,68.45,45.05,134.8,33.35,113.5,168.15,170.25,-7973.76,MAX_LOSS_EXIT_STRICT,NIFTY24020822200CE.csv,NIFTY24020821600PE.csv,2024-02-02 11:39:00,-8197.5,,-16058.76
February,02-02-2024,10:00:00,11:39:00,150,22250,21650,58.1,48.05,112.9,39.0,106.15,151.9,159.225,-6675.2,MAX_LOSS_EXIT_STRICT,NIFTY24020822250CE.csv,NIFTY24020821650PE.csv,2024-02-02 11:39:00,-6862.5,,-22733.96
February,02-02-2024,10:15:00,11:39:00,150,22250,21650,57.75,48.45,112.9,39.0,106.2,151.9,159.3,-6667.9,MAX_LOSS_EXIT_STRICT,NIFTY24020822250CE.csv,NIFTY24020821650PE.csv,2024-02-02 11:39:00,-6855.0,,-29401.86
February,02-02-2024,10:30:00,11:39:00,150,22250,21650,57.0,46.85,112.9,39.0,103.85,151.9,155.775,-7010.78,MAX_LOSS_EXIT_STRICT,NIFTY24020822250CE.csv,NIFTY24020821650PE.csv,2024-02-02 11:39:00,-7207.5,,-36412.64
February,02-02-2024,11:00:00,11:39:00,150,22250,21650,55.65,45.5,112.9,39.0,101.15,151.9,151.725,-7612.5,PAIR_STOPLOSS_HIT,NIFTY24020822250CE.csv,NIFTY24020821650PE.csv,2024-02-02 11:39:00,,,-44025.14
February,02-02-2024,11:15:00,11:39:00,150,22300,21700,62.0,49.05,93.6,45.4,111.05,139.0,166.575,-4078.07,MAX_LOSS_EXIT_STRICT,NIFTY24020822300CE.csv,NIFTY24020821700PE.csv,2024-02-02 11:39:00,-4192.5,,-48103.21
February,02-02-2024,11:30:00,11:39:00,150,22350,21750,61.7,55.0,76.55,53.15,116.7,129.7,175.05,-1896.78,MAX_LOSS_EXIT_STRICT,NIFTY24020822350CE.csv,NIFTY24020821750PE.csv,2024-02-02 11:39:00,-1950.0,,-49999.99
February,05-02-2024,09:45:00,14:42:00,150,22150,21650,63.1,65.25,26.6,99.8,128.35,126.4,192.525,245.28,MAX_LOSS_EXIT_STRICT,NIFTY24020822150CE.csv,NIFTY24020821650PE.csv,2024-02-05 14:42:00,292.5,,245.28
February,05-02-2024,10:00:00,14:42:00,150,22200,21700,62.7,68.4,21.25,120.05,131.1,141.3,196.65,-1283.02,MAX_LOSS_EXIT_STRICT,NIFTY24020822200CE.csv,NIFTY24020821700PE.csv,2024-02-05 14:42:00,-1530.0,,-1037.74
February,05-02-2024,10:15:00,14:42:00,150,22200,21700,56.55,72.2,21.25,120.05,128.75,141.3,193.125,-1578.62,MAX_LOSS_EXIT_STRICT,NIFTY24020822200CE.csv,NIFTY24020821700PE.csv,2024-02-05 14:42:00,-1882.5,,-2616.3599999999997
February,05-02-2024,10:30:00,14:42:00,150,22150,21650,52.25,70.15,26.6,99.8,122.4,126.4,183.6,-503.14,MAX_LOSS_EXIT_STRICT,NIFTY24020822150CE.csv,NIFTY24020821650PE.csv,2024-02-05 14:42:00,-600.0,,-3119.4999999999995
February,05-02-2024,10:45:00,14:42:00,150,22150,21650,61.7,58.55,26.6,99.8,120.25,126.4,180.375,-773.58,MAX_LOSS_EXIT_STRICT,NIFTY24020822150CE.csv,NIFTY24020821650PE.csv,2024-02-05 14:42:00,-922.5,,-3893.0799999999995
February,05-02-2024,11:00:00,14:42:00,150,22150,21650,57.45,59.85,26.6,99.8,117.3,126.4,175.95,-1144.65,MAX_LOSS_EXIT_STRICT,NIFTY24020822150CE.csv,NIFTY24020821650PE.csv,2024-02-05 14:42:00,-1365.0,,-5037.73
February,05-02-2024,11:15:00,14:42:00,150,22150,21650,61.15,55.55,26.6,99.8,116.7,126.4,175.05,-1220.13,MAX_LOSS_EXIT_STRICT,NIFTY24020822150CE.csv,NIFTY24020821650PE.csv,2024-02-05 14:42:00,-1455.0,,-6257.86
February,05-02-2024,11:30:00,14:42:00,150,22150,21650,58.0,54.75,26.6,99.8,112.75,126.4,169.125,-1716.98,MAX_LOSS_EXIT_STRICT,NIFTY24020822150CE.csv,NIFTY24020821650PE.csv,2024-02-05 14:42:00,-2047.5,,-7974.84
February,05-02-2024,11:45:00,14:42:00,150,22150,21650,59.3,53.5,26.6,99.8,112.8,126.4,169.2,-1710.69,MAX_LOSS_EXIT_STRICT,NIFTY24020822150CE.csv,NIFTY24020821650PE.csv,2024-02-05 14:42:00,-2040.0,,-9685.53
February,05-02-2024,12:00:00,14:42:00,150,22150,21650,60.45,49.8,26.6,99.8,110.25,126.4,165.375,-2031.45,MAX_LOSS_EXIT_STRICT,NIFTY24020822150CE.csv,NIFTY24020821650PE.csv,2024-02-05 14:42:00,-2422.5,,-11716.980000000001
February,05-02-2024,12:15:00,14:42:00,150,22200,21700,46.1,60.75,21.25,120.05,106.85,141.3,160.275,-4333.33,MAX_LOSS_EXIT_STRICT,NIFTY24020822200CE.csv,NIFTY24020821700PE.csv,2024-02-05 14:42:00,-5167.5,,-16050.310000000001
February,05-02-2024,12:30:00,14:42:00,150,22150,21650,54.7,52.55,26.6,99.8,107.25,126.4,160.875,-2408.81,MAX_LOSS_EXIT_STRICT,NIFTY24020822150CE.csv,NIFTY24020821650PE.csv,2024-02-05 14:42:00,-2872.5,,-18459.120000000003
February,05-02-2024,12:45:00,14:42:00,150,22200,21700,45.65,59.05,21.25,120.05,104.7,141.3,157.05,-4603.77,MAX_LOSS_EXIT_STRICT,NIFTY24020822200CE.csv,NIFTY24020821700PE.csv,2024-02-05 14:42:00,-5490.0,,-23062.890000000003
February,05-02-2024,13:00:00,14:42:00,150,22200,21700,48.3,56.85,21.25,120.05,105.15,141.3,157.725,-4547.17,MAX_LOSS_EXIT_STRICT,NIFTY24020822200CE.csv,NIFTY24020821700PE.csv,2024-02-05 14:42:00,-5422.5,,-27610.060000000005
February,05-02-2024,13:15:00,14:42:00,150,22200,21700,48.95,56.1,21.25,120.05,105.05,141.3,157.575,-4559.75,MAX_LOSS_EXIT_STRICT,NIFTY24020822200CE.csv,NIFTY24020821700PE.csv,2024-02-05 14:42:00,-5437.5,,-32169.810000000005
February,05-02-2024,13:30:00,14:42:00,150,22150,21650,53.6,51.1,26.6,99.8,104.7,126.4,157.05,-2729.56,MAX_LOSS_EXIT_STRICT,NIFTY24020822150CE.csv,NIFTY24020821650PE.csv,2024-02-05 14:42:00,-3255.0,,-34899.37
February,05-02-2024,13:45:00,14:42:00,150,22150,21650,54.25,48.3,26.6,99.8,102.55,126.4,153.825,-3000.0,MAX_LOSS_EXIT_STRICT,NIFTY24020822150CE.csv,NIFTY24020821650PE.csv,2024-02-05 14:42:00,-3577.5,,-37899.37
February,05-02-2024,14:00:00,14:42:00,150,22200,21700,46.2,53.95,21.25,120.05,100.15,141.3,150.225,-5176.1,MAX_LOSS_EXIT_STRICT,NIFTY24020822200CE.csv,NIFTY24020821700PE.csv,2024-02-05 14:42:00,-6172.5,,-43075.47
February,05-02-2024,14:15:00,14:42:00,150,22150,21650,49.6,49.3,26.6,99.8,98.9,126.4,148.35,-3459.12,MAX_LOSS_EXIT_STRICT,NIFTY24020822150CE.csv,NIFTY24020821650PE.csv,2024-02-05 14:42:00,-4125.0,,-46534.590000000004
February,05-02-2024,14:30:00,14:42:00,150,22150,21650,44.75,54.1,26.6,99.8,98.85,126.4,148.275,-3465.41,MAX_LOSS_EXIT_STRICT,NIFTY24020822150CE.csv,NIFTY24020821650PE.csv,2024-02-05 14:42:00,-4132.5,,-50000.0
February,06-02-2024,09:45:00,14:59:00,150,22100,21600,44.05,57.9,46.75,30.8,101.95,77.55,152.925,3660.0,FORCE_EXIT_1459,NIFTY24020822100CE.csv,NIFTY24020821600PE.csv,2024-02-06 14:59:00,,,3660.0
February,06-02-2024,10:00:00,14:59:00,150,22100,21600,44.3,53.35,46.75,30.8,97.65,77.55,146.475,3015.0,FORCE_EXIT_1459,NIFTY24020822100CE.csv,NIFTY24020821600PE.csv,2024-02-06 14:59:00,,,6675.0
February,06-02-2024,10:15:00,14:59:00,150,22100,21600,42.15,52.55,46.75,30.8,94.7,77.55,142.05,2572.5,FORCE_EXIT_1459,NIFTY24020822100CE.csv,NIFTY24020821600PE.csv,2024-02-06 14:59:00,,,9247.5
February,06-02-2024,10:30:00,14:59:00,150,22050,21550,39.25,50.8,62.05,24.35,90.05,86.4,135.075,547.5,FORCE_EXIT_1459,NIFTY24020822050CE.csv,NIFTY24020821550PE.csv,2024-02-06 14:59:00,,,9795.0
February,06-02-2024,10:45:00,14:59:00,150,22100,21600,33.5,54.75,46.75,30.8,88.25,77.55,132.375,1605.0,FORCE_EXIT_1459,NIFTY24020822100CE.csv,NIFTY24020821600PE.csv,2024-02-06 14:59:00,,,11400.0
February,06-02-2024,11:00:00,14:59:00,150,22100,21600,38.6,45.3,46.75,30.8,83.9,77.55,125.85,952.5,FORCE_EXIT_1459,NIFTY24020822100CE.csv,NIFTY24020821600PE.csv,2024-02-06 14:59:00,,,12352.5
February,06-02-2024,11:15:00,14:59:00,150,22100,21600,37.65,45.15,46.75,30.8,82.8,77.55,124.2,787.5,FORCE_EXIT_1459,NIFTY24020822100CE.csv,NIFTY24020821600PE.csv,2024-02-06 14:59:00,,,13140.0
February,06-02-2024,11:30:00,14:59:00,150,22100,21600,36.85,46.1,46.75,30.8,82.95,77.55,124.425,810.0,FORCE_EXIT_1459,NIFTY24020822100CE.csv,NIFTY24020821600PE.csv,2024-02-06 14:59:00,,,13950.0
February,06-02-2024,11:45:00,14:59:00,150,22150,21650,31.4,50.45,34.8,38.9,81.85,73.7,122.775,1222.5,FORCE_EXIT_1459,NIFTY24020822150CE.csv,NIFTY24020821650PE.csv,2024-02-06 14:59:00,,,15172.5
February,06-02-2024,12:00:00,14:59:00,150,22150,21650,33.9,46.5,34.8,38.9,80.4,73.7,120.6,1005.0,FORCE_EXIT_1459,NIFTY24020822150CE.csv,NIFTY24020821650PE.csv,2024-02-06 14:59:00,,,16177.5
February,06-02-2024,12:15:00,14:59:00,150,22150,21650,37.95,44.9,34.8,38.9,82.85,73.7,124.275,1372.5,FORCE_EXIT_1459,NIFTY24020822150CE.csv,NIFTY24020821650PE.csv,2024-02-06 14:59:00,,,17550.0
February,06-02-2024,12:30:00,14:59:00,150,22150,21650,32.65,46.8,34.8,38.9,79.45,73.7,119.175,862.5,FORCE_EXIT_1459,NIFTY24020822150CE.csv,NIFTY24020821650PE.csv,2024-02-06 14:59:00,,,18412.5
February,06-02-2024,12:45:00,14:59:00,150,22150,21650,41.05,41.45,34.8,38.9,82.5,73.7,123.75,1320.0,FORCE_EXIT_1459,NIFTY24020822150CE.csv,NIFTY24020821650PE.csv,2024-02-06 14:59:00,,,19732.5
February,06-02-2024,13:00:00,14:59:00,150,22150,21650,32.4,46.8,34.8,38.9,79.2,73.7,118.8,825.0,FORCE_EXIT_1459,NIFTY24020822150CE.csv,NIFTY24020821650PE.csv,2024-02-06 14:59:00,,,20557.5
February,06-02-2024,13:15:00,14:59:00,150,22150,21650,36.35,42.5,34.8,38.9,78.85,73.7,118.275,772.5,FORCE_EXIT_1459,NIFTY24020822150CE.csv,NIFTY24020821650PE.csv,2024-02-06 14:59:00,,,21330.0
February,06-02-2024,13:30:00,14:59:00,150,22200,21700,32.0,49.0,25.0,48.9,81.0,73.9,121.5,1065.0,FORCE_EXIT_1459,NIFTY24020822200CE.csv,NIFTY24020821700PE.csv,2024-02-06 14:59:00,,,22395.0
February,06-02-2024,13:45:00,14:59:00,150,22150,21650,36.45,39.75,34.8,38.9,76.2,73.7,114.3,375.0,FORCE_EXIT_1459,NIFTY24020822150CE.csv,NIFTY24020821650PE.csv,2024-02-06 14:59:00,,,22770.0
February,06-02-2024,14:00:00,14:59:00,150,22150,21650,37.85,40.35,34.8,38.9,78.2,73.7,117.3,675.0,FORCE_EXIT_1459,NIFTY24020822150CE.csv,NIFTY24020821650PE.csv,2024-02-06 14:59:00,,,23445.0
February,06-02-2024,14:15:00,14:59:00,150,22150,21650,38.3,38.95,34.8,38.9,77.25,73.7,115.875,532.5,FORCE_EXIT_1459,NIFTY24020822150CE.csv,NIFTY24020821650PE.csv,2024-02-06 14:59:00,,,23977.5
February,06-02-2024,14:30:00,14:59:00,150,22150,21650,35.8,40.85,34.8,38.9,76.65,73.7,114.975,442.5,FORCE_EXIT_1459,NIFTY24020822150CE.csv,NIFTY24020821650PE.csv,2024-02-06 14:59:00,,,24420.0
February,06-02-2024,14:45:00,14:59:00,150,22150,21650,36.15,38.0,34.8,38.9,74.15,73.7,111.225,67.5,FORCE_EXIT_1459,NIFTY24020822150CE.csv,NIFTY24020821650PE.csv,2024-02-06 14:59:00,,,24487.5
February,07-02-2024,09:45:00,14:59:00,150,22200,21800,32.8,41.2,7.85,33.5,74.0,41.35,111.0,4897.5,FORCE_EXIT_1459,NIFTY24020822200CE.csv,NIFTY24020821800PE.csv,2024-02-07 14:59:00,,,4897.5
February,07-02-2024,10:00:00,14:59:00,150,22200,21800,31.2,35.1,7.85,33.5,66.3,41.35,99.45,3742.5,FORCE_EXIT_1459,NIFTY24020822200CE.csv,NIFTY24020821800PE.csv,2024-02-07 14:59:00,,,8640.0
February,07-02-2024,10:15:00,14:59:00,150,22200,21800,29.75,34.4,7.85,33.5,64.15,41.35,96.225,3420.0,FORCE_EXIT_1459,NIFTY24020822200CE.csv,NIFTY24020821800PE.csv,2024-02-07 14:59:00,,,12060.0
February,07-02-2024,10:30:00,14:59:00,150,22200,21800,26.4,33.95,7.85,33.5,60.35,41.35,90.525,2850.0,FORCE_EXIT_1459,NIFTY24020822200CE.csv,NIFTY24020821800PE.csv,2024-02-07 14:59:00,,,14910.0
February,07-02-2024,10:45:00,14:59:00,150,22150,21750,32.45,29.3,12.55,22.5,61.75,35.05,92.625,4005.0,FORCE_EXIT_1459,NIFTY24020822150CE.csv,NIFTY24020821750PE.csv,2024-02-07 14:59:00,,,18915.0
